"ProgElemID","ParentID","Name_EN","Description_EN","Active"
"ACOA-SO0021","ACOA","A competitive Atlantic Canadian economy","",1
"ACOA-SO1999","ACOA","Internal Services","",1
"AECB-SO0331","AECB","Safe and secure nuclear installations and processes used solely for peaceful purposes and an informed public on the effectiveness of Canada's nuclear regulatory regime","",1
"AECB-SO1999","AECB","Internal Services","",1
"AECL-SO0031","AECL","Be the top worldwide nuclear products and services company. Protect the health and safety of the public, our employees and the environment. Minimize nuclear legacy obligations for future generations","",1
"AGR-SO0011","AGR","A competitive and market-oriented agriculture, agri-food and agri-based products sector that proactively manages risk","",1
"AGR-SO0012","AGR","An innovative and sustainable agriculture, agri-food and agri-based products sector","",1
"AGR-SO0013","AGR","An environmentally sustainable agriculture, agri-food and agri-based products sector","",0
"AGR-SO1999","AGR","Internal Services","",1
"AHRAC-SO0051","AHRAC","Protection and promotion of health and safety of Canadians in relation to assisted human reproduction and related to research, within a sound ethical framework","",0
"AHRAC-SO1999","AHRAC","Internal Services","",0
"APPRT-SO0141","APPRT","The rights of artists and producers under Part II of the Status of the Artist Act are protected and respected","",0
"APPRT-SO1999","APPRT","Internal Services","",0
"ATSSC-SO0001","ATSSC","Efficient and effective services which support tribunal chairs and members in exercising their statutory responsibilities and ensure that their independence is protected in a manner which promotes Canadians' confidence in the federal tribunal system","",1
"ATSSC-SO1999","ATSSC","Internal Services","",1
"CAS-SO0471","CAS","The public has timely and fair access to the litigation processes of the Federal Court of Appeal, the Federal Court, the Court Martial Appeal Court of Canada and the Tax Court of Canada","",1
"CAS-SO1999","CAS","Internal Services","",1
"CAT-SO1301","CAT","The Canadian transportation community is provided with the opportunity to have enforcement and licensing decisions of the Minister of Transport reviewed in a fair manner by unbiased hearing officers","",0
"CAT-SO1999","CAT","Internal Services","",0
"CATSA-SO0131","CATSA","Screening programs at designated Canadian airports protect the travelling public","",1
"CB-SO0451","CB","Fair decision-making to provide proper incentives for the creation and use of copyrighted works","",1
"CB-SO1999","CB","Internal Services","",1
"CBC-SO0151","CBC","A national public broadcasting service exists that is primarily Canadian in content and connects citizens to the Canadian experience","",1
"CBSA-SO0061","CBSA","International trade and travel is facilitated across Canada's border and Canada's population is protected from border-related risks","",1
"CBSA-SO1999","CBSA","Internal Services","",1
"CC-SO0071","CC","A vibrant and dynamic arts sector in Canada","",1
"CCC-SO0171","CCC","Enhanced market access for Canadian exporters to complex international public sector markets","",0
"CCMD-SO0121","CCMD","Federal public service employees have the common knowledge, skills and competencies to fulfill their responsibilities in serving Canadians","",1
"CCMD-SO1999","CCMD","Internal Services","",1
"CCOHS-SO0161","CCOHS","Improved workplace conditions and practices that enhance the health, safety, and well being of working Canadians","",1
"CCOHS-SO1999","CCOHS","Internal Services","",1
"CCRA-BRA00","CCRA","Tax","To ensure that Canada’s voluntary self-assessment tax system is sustained by providing taxpayers with the support and information they need to understand and fulfill their tax obligations, and by taking compliance and enforcement action when necessary to uphold the integrity of the system, offering avenues for redress whenever taxpayers may disagree with an assessment/decision.",1
"CCRA-BRB00","CCRA","Benefits","To ensure that Canadians obtain the support and information they need to know what benefits they may be eligible to receive, that they receive their benefit payments in a timely manner, and have avenues of redress when they disagree with a decision on their benefit eligibility.",1
"CCRA-BRC00","CCRA","Taxpayers' Ombudsman","Canadians have access to trusted and independent review of service complaints about the CRA.",1
"CCRA-ISS00","CCRA","Internal Services","Internal Services are those groups of related activities and resources that the Federal Government considers to be services in support of programs and/or required to meet corporate obligations of an organization. Internal Services refer to the activities and resources of the ten distinct services that support program delivery in the organization, regardless of the Internal Services delivery model in a department. These services are Acquisition Management Services, Communications Services, Financial Management Services, Human Resources Management Services, Information Management Services, Information Technology Services, Legal Services, Materiel Management Services, Management and Oversight Services, Real Property Management Services.",1
"CCRA-SO0111","CCRA","Eligible families and individuals receive timely and accurate benefit payments","",0
"CCRA-SO0112","CCRA","Taxpayers and benefit recipients receive an independent and impartial review of their service related complaints","",0
"CCRA-SO0113","CCRA","Taxpayers meet their obligations and Canada's revenue base is protected","",0
"CCRA-SO1999","CCRA","Internal Services","",0
"CDC-SO0181","CDC","To enhance the vitality of the Canadian dairy industry for the benefit of all stakeholders","",1
"CEAA-SO0191","CEAA","High quality and timely environmental assessments of major projects to protect the environment and support economic growth","",1
"CEAA-SO1999","CEAA","Internal Services","",1
"CEO-SO0411","CEO","An Accessible Electoral Framework that Canadians Trust and Use","",1
"CEO-SO1999","CEO","Internal Services","",1
"CFDC-SO1261","CFDC","Quality audiovisual content developed by Canadians and promoted to audiences in Canada and internationally","",1
"CFDC-SO1999","CFDC","Internal Services","",1
"CFGB-SO0731","CFGB","The Chief of the Defence Staff and members of the Canadian Armed Forces have access to a fair, independent and timely review of military grievances","",1
"CFGB-SO1999","CFGB","Internal Services","",1
"CFIA-SO0201","CFIA","A safe and accessible food supply and plant and animal resource base","",1
"CFIA-SO1999","CFIA","Internal Services","",1
"CGC-SO0211","CGC","Canada's grain is safe, reliable and marketable and Canadian grain producers are properly compensated for grain deliveries to licensed grain companies","",1
"CGC-SO0212","CGC","Canada's grain is safe, reliable and marketable and Canadian grain producers are protected","",0
"CGC-SO1999","CGC","Internal Services","",1
"CH-SO0221","CH","Canadian artistic expressions and cultural content are created and accessible at home and abroad","",1
"CH-SO0222","CH","Canadians participate and excel in sport","",1
"CH-SO0223","CH","Canadians share, express and appreciate their Canadian identity","",1
"CH-SO1999","CH","Internal Services","",1
"CHRC-BSA00","CHRC","Engagement and Advocacy","Provide a national credible voice for equality in Canada – my Canada includes everyone; promote broadly human rights in Canada by raising public awareness of human rights issues; and engage civil society,  governments, employers and the public in dialogue and action to affect human rights change.",1
"CHRC-BSB00","CHRC","Human Rights Complaints","Provide people in Canada with a mechanism to file human rights complaints and remedies to victims of discrimination; reduce instances of systemic discrimination; and represent the public interest in legal cases to advance human rights in Canada",1
"CHRC-BSC00","CHRC","Employment Equity Audits","Ensure employer's compliance with employment equity statutory requirements; encourage employers to identify barriers to employment and implement best practices to eliminate gaps in the representation of women, visible minority groups, aboriginal peoples and persons with disabilities",1
"CHRC-ISS00","CHRC","Internal Services","Internal Services are those groups of related activities and resources that the Federal Government considers to be services in support of programs and/or required to meet corporate obligations of an organization. Internal Services refer to the activities and resources of the ten distinct services that support program delivery in the organization, regardless of the Internal Services delivery model in a department. These services are Acquisition Management Services, Communications Services, Financial Management Services, Human Resources Management Services, Information Management Services, Information Technology Services, Legal Services, Materiel Management Services, Management and Oversight Services, Real Property Management Services.",1
"CHRC-SO0231","CHRC","Equality of opportunity and respect for human rights","",0
"CHRC-SO1999","CHRC","Internal Services","",0
"CHRT-SO0241","CHRT","Individuals have access, as determined by the Canadian Human Rights Act and the Employment Equity Act, to fair and equitable adjudication of human rights and employment equity cases that are brought before the Canadian Human Rights Tribunal","",0
"CHRT-SO1999","CHRT","Internal Services","",0
"CI-SO0421","CI","Family and humanitarian migration that reunites families and offers protection to the displaced and persecuted","",1
"CI-SO0422","CI","Managed migration and facilitated travel that promote Canadian interests and protect the health, safety and security of Canadians","",1
"CI-SO0423","CI","Migration of permanent and temporary residents that strengthens Canada's economy","",1
"CI-SO0424","CI","Newcomers and citizens participate in fostering an integrated society","",1
"CI-SO0581","CI","International Commercial and Consular Services for Canadians - Canadians are satisfied with commercial and consular services","",0
"CI-SO1999","CI","Internal Services","",1
"CICS-SO0261","CICS","Senior-level intergovernmental conference services are professionally and successfully delivered","",1
"CICS-SO1999","CICS","Internal Services","",1
"CIDA-SO0582","CIDA","Reduction in poverty for those living in countries where Canada engages in international development","",0
"CIDA-SO1999","CIDA","Internal Services","",0
"CIHR-SO0251","CIHR","Canada is a world leader in the creation, dissemination and application of health research knowledge","",1
"CIHR-SO0252","CIHR","A world-class health-research enterprise that creates, disseminates and applies new knowledge across all areas of health research","",0
"CIHR-SO1999","CIHR","Internal Services","",1
"CIRB-SO0081","CIRB","Effective dispute resolution services that support constructive labour management relations in sectors regulated by the Canada Labour Code and professional relations in sectors regulated by the Status of the Artist Act","",0
"CIRB-SO1999","CIRB","Internal Services","",0
"CITT-SO0271","CITT","Fair, timely and transparent disposition of international trade cases, procurement cases and government mandated inquiries within the Tribunal's jurisdiction","",0
"CITT-SO1999","CITT","Internal Services","",0
"CLVM-SO0991","CLVM","An urban park dedicated to recreational, tourist and cultural activities that safeguard and promote the Old Port of Montreal's cultural heritage while facilitating public access to the waterfront","",0
"CMC-SO0291","CMC","Interest in, knowledge of and appreciation and respect for human cultural achievements and human behaviour through collections of historical and cultural objects, exhibitions, programs and research reflecting a Canadian perspective","",1
"CMHC-SO0091","CMHC","Canada has a stable, competitive and innovative housing system","",1
"CMHC-SO0092","CMHC","Canadians in need have access to affordable housing","",1
"CMHC-SO0093","CMHC","Strengthened competitiveness and innovation of the housing sector in order to meet the housing needs of Canadians","",0
"CMHC-SO0094","CMHC","Increased availability of safe, affordable housing for Canadians in need, including Aboriginal Canadians","",0
"CMHC-SO0095","CMHC","The Canadian housing system remains one of the best in the world","",0
"CMHR-SO0281","CMHR","Enhanced knowledge of human rights, with special but not exclusive reference to Canada, in order to enhance the public's understanding of human rights, to promote respect for others and to encourage reflection and dialogue","",1
"CMI-SO0301","CMI","Canadians are engaged in building and exploring the stories, themes and history of Canadian immigration as it continues to unfold","",1
"CMN-SO0311","CMN","Interest in, knowledge of and appreciation and respect for the natural world through collections of natural history objects, public education programmes and research reflecting a special but not exclusive perspective on Canada","",1
"CNEDA-SO0321","CNEDA","Developed and diversified territorial economies that support prosperity for all Northerners","",1
"CNEDA-SO1999","CNEDA","Internal Services","",1
"CNMI-SO0721","CNMI","A safe, reliable, efficient, affordable and environmentally responsible ferry service between the Island of Newfoundland and the Province of Nova Scotia","",1
"CPC-SO0101","CPC","Compensation for the provision of Parliamentary mail and Materials for the use of the blind services, which are sent free of postage under the Canada Post Corporation Act","",1
"CPCC-SO0341","CPCC","Increased Canadian polar knowledge","",0
"CPCC-SO0342","CPCC","Canada has world-class Arctic science and technology to support the development and stewardship of Canada's North and is recognized as a leader on circumpolar research issues","",1
"CPCC-SO1999","CPCC","Internal Services","",1
"CRTC-SO0351","CRTC","Canadians have access to a world-class communication system","",1
"CRTC-SO0352","CRTC","Canadians have access to a wide variety of high quality Canadian produced programming and to reliable, affordable and high quality telecommunication services","",0
"CRTC-SO1999","CRTC","Internal Services","",1
"CSA-SO0371","CSA","Canada's exploration of space, provision of space services and development of its space capacity meet the nation's needs for scientific knowledge, innovation and information","",1
"CSA-SO1999","CSA","Internal Services","",1
"CSC-SO0461","CSC","The custody, correctional interventions, and supervision of offenders in communities and in institutions, contribute to public safety","",1
"CSC-SO1999","CSC","Internal Services","",1
"CSEC-SO0441","CSEC","Foreign signals intelligence and technical security capabilities advance and protect Canada's vital interests","",1
"CSEC-SO0785","CSEC","Defence operations improve peace, stability and security wherever deployed","",0
"CSIS-SO0361","CSIS","Intelligence is used to protect the security and safety of Canada and its citizens","",1
"CT-SO1131","CT","Open, fair, transparent and expeditious hearings related to the Tribunal's jurisdiction","",0
"CT-SO1999","CT","Internal Services","",0
"CTA-SO0401","CTA","Transparent, fair and timely dispute resolution and economic regulation of the national transportation system","",1
"CTA-SO1999","CTA","Internal Services","",1
"CTAIB-BWA00","CTAIB","Independent safety investigations and communication of risks in the transportation system","The TSB’s sole objective is to advance air, marine, rail and pipeline transportation safety. This mandate is fulfilled by conducting independent investigations into selected transportation occurrences to identify the causes and contributing factors, and the safety deficiencies evidenced by these occurrences. The TSB makes recommendations to reduce or eliminate any such safety deficiencies and reports publicly on its investigations. The TSB then follows up with stakeholders to ensure that safety actions are taken to reduce risks and improve safety.",1
"CTAIB-ISS00","CTAIB","Internal Services","Internal Services are those groups of related activities and resources that the Federal Government considers to be services in support of programs and/or required to meet corporate obligations of an organization. Internal Services refer to the activities and resources of the ten distinct services that support program delivery in the organization, regardless of the Internal Services delivery model in a department. These services are Acquisition Management Services, Communications Services, Financial Management Services, Human Resources Management Services, Information Management Services, Information Technology Services, Legal Services, Materiel Management Services, Management and Oversight Services, Real Property Management Services.",1
"CTAIB-SO0391","CTAIB","Independent investigations into transportation occurrences contribute to making the transportation system safer","",0
"CTAIB-SO1999","CTAIB","Internal Services","",0
"EA-SO0581","EA","International Commercial and Consular Services for Canadians - Canadians are satisfied with commercial and consular services","",1
"EA-SO0582","EA","Reduction in poverty for those living in countries where Canada engages in international development","",0
"EA-SO0583","EA","Canada's Network Abroad - The Department maintains a mission network of infrastructure and services to enable the Government of Canada to achieve its international priorities","",1
"EA-SO0584","EA","Canada's International Agenda - The international agenda is shaped to advance Canadian security, prosperity, interests and values","",1
"EA-SO0585","EA","International Assistance and Poverty Alleviation - Poverty is reduced, and security and democracy are increased for those living in countries where Canada engages","",1
"EA-SO1999","EA","Internal Services","",1
"EC-SO0511","EC","Canada's natural environment is conserved and restored for present and future generations","",1
"EC-SO0512","EC","Canadians are equipped to make informed decisions on changing weather, water and climate conditions","",1
"EC-SO0513","EC","Threats to Canadians and their environment from pollution are minimized","",1
"EC-SO1999","EC","Internal Services","",1
"ECBC-SO0501","ECBC","A competitive and sustainable Cape Breton economy","",0
"EDC-SO0581","EDC","International Commercial and Consular Services for Canadians - Canadians are satisfied with commercial and consular services","",0
"ERC-SO1161","ERC","Fair and transparent labour relations decision-making that reinforces accountability","",1
"ERC-SO1999","ERC","Internal Services","",0
"FBCL-SO0521","FBCL","Safe and efficient transit on the infrastructure maintained, operated and managed by The Federal Bridge Corporation Limited","",1
"FCAC-SO0542","FCAC","The rights of financial consumers are protected and the financial literacy of Canadians is strengthened","",0
"FEDSO-SO0531","FEDSO","A Competitive Southern Ontario Economy","",1
"FEDSO-SO0532","FEDSO","The economy of Southern Ontario is competitive and diversified","",0
"FEDSO-SO1999","FEDSO","Internal Services","",1
"FIN-SO0541","FIN","A strong economy and sound public finances for Canadians","",1
"FIN-SO1999","FIN","Internal Services","",1
"FJA-SO0431","FJA","An independent and efficient Federal Judiciary","",1
"FJA-SO1999","FJA","Internal Services","",1
"FNSI-SO0561","FNSI","First Nations, governments and other interested parties will have accurate, and relevant statistical information and analysis on the fiscal, economic and social conditions of First Nations","",0
"FO-SO0571","FO","Economically Prosperous Maritime Sectors and Fisheries","",1
"FO-SO0572","FO","Safe and Secure Waters","",1
"FO-SO0573","FO","Sustainable Aquatic Ecosystems","",1
"FO-SO1999","FO","Internal Services","",1
"FORDQ-SO0481","FORDQ","Quebec's regions have a growing economy","",1
"FORDQ-SO0482","FORDQ","A competitive and diversified economy for the regions of Quebec","",0
"FORDQ-SO1999","FORDQ","Internal Services","",1
"FTRAC-SO0551","FTRAC","A Canadian financial system resistant to money laundering and terrorist financing","",1
"FTRAC-SO0552","FTRAC","FINTRAC's detection and deterrence of money laundering and terrorist financing contributes to the public safety of Canadians and helps protect the integrity of Canada's financial system","",0
"FTRAC-SO1999","FTRAC","Internal Services","",1
"GG-SO0591","GG","The Governor General, representing The Queen in Canada, is enabled to fulfill constitutional, state, ceremonial and public duties","",1
"GG-SO1999","GG","Internal Services","",1
"GSC-SO1121","GSC","High quality, central programs and services that ensure sound stewardship on behalf of Canadians and meet the program needs of federal institutions","",1
"GSC-SO1999","GSC","Internal Services","",1
"H-SO0611","H","A health system responsive to the needs of Canadians","",1
"H-SO0612","H","First Nations and Inuit communities and individuals receive health services and benefits that are responsive to their needs so as to improve their health status","",1
"H-SO0613","H","Health risks and benefits associated with food, products, substances, and environmental factors are appropriately managed and communicated to Canadians","",1
"H-SO0614","H","Canadians are informed of and protected from health risks associated with food, products, substances and environments, and are informed of the benefits of healthy eating","",0
"H-SO1999","H","Internal Services","",1
"HC-SO0621","HC","Effective administrative and professional support for Members, both individually and collectively, in their roles as legislators and representatives of 338 constituencies, in the Chamber, in committee and in caucus","",1
"HMIRC-SO0601","HMIRC","Chemical trade secrets are protected and required health and safety information in Canadian workplaces is compliant","",0
"HMIRC-SO1999","HMIRC","Internal Services","",0
"HRSD-SO0491","HRSD","A skilled, adaptable and inclusive labour force and an efficient labour market","",1
"HRSD-SO0492","HRSD","Income security, access to opportunities and well-being for individuals, families and communities","",1
"HRSD-SO0493","HRSD","Safe, fair and productive workplaces and cooperative workplace relations","",1
"HRSD-SO0494","HRSD","Service Excellence for Canadians","",0
"HRSD-SO0495","HRSD","Government-Wide Service Excellence","",1
"HRSD-SO1999","HRSD","Internal Services","",1
"IDRC-SO0671","IDRC","Stronger capacity in developing countries to research and propose solutions that support sustainable and equitable development and poverty reduction","",1
"IJC-SO0681","IJC","Prompt and effective prevention and/or resolution of potential disputes under the Boundary Water Treaty and Great Lakes Water Quality Agreement to ensure they have no negative impact on Canada-US relations","",1
"INAC-SO0641","INAC","The Government - Support good governance, rights and interests of Indigenous Peoples","",1
"INAC-SO0642","INAC","The Land and Economy - Full participation of First Nations, Métis, Non Status Indians and Inuit individuals and communities in the economy","",1
"INAC-SO0643","INAC","The North - Self-reliance, prosperity and well-being for the people and communities of the North","",1
"INAC-SO0644","INAC","The People - Individual, family and community well-being for First Nations and Inuit","",1
"INAC-SO0645","INAC","The Government – Good governance and co-operative relationships for First Nations, Métis, Non-Status Indians, Inuit and Northerners","",0
"INAC-SO0646","INAC","Office of the Federal Interlocutor – Socio-economic well-being of Métis, non-status Indians and urban Aboriginal people","",0
"INAC-SO1999","INAC","Internal Services","",1
"IPC-SO0981","IPC","Rights under the Access to Information Act are safeguarded","",1
"IPC-SO0982","IPC","The privacy rights of individuals are protected","",1
"IPC-SO1999","IPC","Internal Services","",1
"IRB-SO0631","IRB","Resolve immigration and refugee cases before the Immigration and Refugee Board of Canada efficiently, fairly and in accordance with the law","",1
"IRB-SO1999","IRB","Internal Services","",1
"ISC-SO0661","ISC","Advancements in science and technology, knowledge, and innovation strengthen the Canadian economy","",1
"ISC-SO0662","ISC","Canadian businesses and communities are competitive","",1
"ISC-SO0663","ISC","The Canadian marketplace is efficient and competitive","",1
"ISC-SO1999","ISC","Internal Services","",1
"JCCB-SO1271","JCCB","Safe and efficient transit on the infrastructure maintained, operated and managed by the Jacques Cartier and Champlain Bridges Incorporated","",1
"JUS-SO0691","JUS","A Federal Government that is Supported by High-Quality Legal Services","",1
"JUS-SO0692","JUS","A fair, relevant and accessible Canadian justice system","",1
"JUS-SO1999","JUS","Internal Services","",1
"LAC-SO0701","LAC","Canada's documentary heritage is preserved and accessible to current and future generations","",1
"LAC-SO0702","LAC","Current government information is managed to support government accountability","",1
"LAC-SO1999","LAC","Internal Services","",1
"LP-SO0711","LP","An Informed and Accessible Parliament","",1
"LP-SO1999","LP","Internal Services","",1
"MPCC-SO0741","MPCC","The Military Police Complaints Commission (MPCC) ensures that the Canadian Forces Military Police has the highest standard of conduct according to law and police best practices, and is free from interference in its investigations","",1
"MPCC-SO1999","MPCC","Internal Services","",1
"NAC-SO0751","NAC","Strong and dynamic performing arts in the National Capital Region and across Canada","",1
"NBC-SO0761","NBC","The Battlefields Park of Quebec is a prestigious, natural, accessible, safe and educational historic and urban site","",1
"NBC-SO1999","NBC","Internal Services","",1
