"ProgElemID","ParentID","Name_EN","Description_EN","Active"
"NCC-SO0771","NCC","Canada's Capital Region is of national significance and is a source of pride for Canadians","",1
"ND-SO0781","ND","Defence Operations and Services Improve Stability and Security, and Promote Canadian Interests and Values","",1
"ND-SO0782","ND","Defence Remains Continually Prepared to Deliver National Defence and Defence Services in Alignment with Canadian Interests and Values","",1
"ND-SO0783","ND","National Defence is ready to meet Government Defence Expectations","",0
"ND-SO0784","ND","Resources are acquired to meet Government Defence Expectations","",0
"ND-SO0785","ND","Defence operations improve peace, stability and security wherever deployed","",0
"ND-SO0786","ND","Care and Support to the Canadian Forces and Contribution to Canadian Society","",0
"ND-SO1999","ND","Internal Services","",1
"NEB-BTB00","NEB","Safety and Environment Oversight","Setting and enforcing regulatory expectations for National Energy Board-regulated companies over the full lifecycle—construction, operation and abandonment— of energy-related activities. These activities pertain to pipelines and related facilities, international power lines, tolls and tariffs, energy exports and imports, and oil and gas exploration and drilling in certain northern and offshore areas of Canada.",1
"NEB-BTC00","NEB","Energy Information","Collecting, monitoring, analyzing and publishing information on energy markets and supply, sources of energy, and the safety and security of pipelines and international power lines.",1
"NEB-BTD00","NEB","Engagement","Engaging with stakeholders and Indigenous Peoples on topics within the National Energy Board’s mandate and role, beyond engagement on specific projects.",1
"NEB-ISS00","NEB","Internal Services","Internal Services are those groups of related activities and resources that the Federal Government considers to be services in support of programs and/or required to meet corporate obligations of an organization. Internal Services refer to the activities and resources of the ten distinct services that support program delivery in the organization, regardless of the Internal Services delivery model in a department. These services are Acquisition Management Services, Communications Services, Financial Management Services, Human Resources Management Services, Information Management Services, Information Technology Services, Legal Services, Materiel Management Services, Management and Oversight Services, Real Property Management Services.",1
"NEB-SO0791","NEB","The regulation of pipelines, power lines, energy development and energy trade contributes to the safety of Canadians, the protection of the environment and efficient energy infrastructure and markets, while respecting the rights and interests of those affected by National Energy Board decisions and recommendations","",0
"NEB-SO0792","NEB","Energy Adjudication","",1
"NEB-SO1999","NEB","Internal Services","",0
"NFB-SO0801","NFB","Canadian stories and perspectives are reflected in audiovisual media and accessible to Canadians and the world","",1
"NFB-SO1999","NFB","Internal Services","",1
"NGC-SO0811","NGC","Interest in, knowledge of and appreciation and respect for visual art through collections of historic and contemporary works of art, programs and research that reflect a special but not exclusive perspective on Canada","",1
"NMST-SO0821","NMST","Interest in, knowledge of and appreciation and respect for science and technology through collections of scientific and technological objects, programs and research reflecting a Canadian perspective","",1
"NPA-SO0871","NPA","The planning and construction of the Canadian portion of the Alaska Highway Gas Pipeline project is efficient and expeditious while ensuring environmental protection and social and economic benefits for Canadians","",1
"NPB-BUA00","NPB","Conditional Release Decisions","Conditional release is based on the principle that community safety is enhanced by the gradual release of offenders to the community when appropriate.  Quality decisions based on the risk of re-offending in conjunction with effective programs and treatment, and effective community supervision all contribute to the process.  Through this core responsibility, PBC staff provides timely, accurate information for Board member decision-making, and develops training and policies that are essential tools for risk assessment and decision-making.",1
"NPB-BUB00","NPB","Conditional Release Openness and Accountability","This core responsibility ensures that the PBC operates in an open and accountable manner, consistent with the provisions of the Corrections and Conditional Release Act (CCRA).  This core responsibility works with victims of crime and the general public by providing information, including access to the PBC's registry of decisions, as well as providing assistance for observers at hearings.  The core responsibility also works to encourage citizen engagement, investigates tragic incidents in the community, monitors the PBC's performance and reports on conditional release processes.",1
"NPB-BUC00","NPB","Record Suspension Decisions/Clemency Recommendations","A record suspension is designed to support the successful reintegration of an individual into society where appropriate.  It is a formal attempt to remove the stigma of a criminal record for people found guilty of a federal offence and who, after satisfying their sentence and specified waiting period, have shown themselves to be responsible law-abiding citizens.  Record suspensions can be revoked or cease to have effect if an individual is convicted of a new indictable offence, or in some cases a summary offence, found to no longer be of good conduct,  found to have made a false or misleading statement or hidden information.  Through this core responsibility the PBC screens applications for completeness and the eligibility of each applicant, collects information for decision-making and develops policy to guide decision processes.  This program is also responsible for assessing requests and providing recommendations under the Royal Prerogative of Mercy (i.e. clemency) and providing advice to the Minister on the merits of each case.  Clemency is granted in exceptional circumstances in deserving cases involving federal offences, where no other remedy exists in law to reduce severe negative effects of criminal sanctions.
",1
"NPB-ISS00","NPB","Internal Services","Internal Services are those groups of related activities and resources that the Federal Government considers to be services in support of programs and/or required to meet corporate obligations of an organization. Internal Services refer to the activities and resources of the ten distinct services that support program delivery in the organization, regardless of the Internal Services delivery model in a department. These services are Acquisition Management Services, Communications Services, Financial Management Services, Human Resources Management Services, Information Management Services, Information Technology Services, Legal Services, Materiel Management Services, Management and Oversight Services, Real Property Management Services.",1
"NPB-SO1021","NPB","Conditional release and record suspension decisions and decision processes that safeguard Canadian communities","",0
"NPB-SO1999","NPB","Internal Services","",0
"NR-SO0851","NR","Canada's natural resource sectors are globally competitive","",1
"NR-SO0852","NR","Canadians have information to manage their lands and natural resources, and are protected from related risks","",1
"NR-SO0853","NR","Natural Resource Sectors and Consumers are Environmentally Responsible","",1
"NR-SO0854","NR","Canada is a world leader on environmental responsibility in the development and use of natural resources","",0
"NR-SO0855","NR","Natural resources knowledge, landmass knowledge and management systems strengthen the safety and security of Canadians and the stewardship of Canada's natural resources and lands","",0
"NR-SO0856","NR","Natural resources sectors are internationally competitive, economically productive, and contribute to the social well-being of Canadians","",0
"NR-SO1999","NR","Internal Services","",1
"NRC-SO0831","NRC","Canadian businesses prosper from innovative technologies","",1
"NRC-SO0832","NRC","Research and Development infrastructure for an innovative and knowledge-based economy","",1
"NRC-SO0833","NRC","Advancements in the development and deployment of innovative technologies in targeted Canadian industries and national priority areas in support of federal priorities in innovation and science and technology","",0
"NRC-SO0834","NRC","Canadians have access to research and development information and infrastructure","",0
"NRC-SO1999","NRC","Internal Services","",1
"NRTEE-SO0841","NRTEE","Federal policy development and decisions in other key sectors are influenced by advice on sustainable development issues pertaining to the environment and the economy","",0
"NRTEE-SO1999","NRTEE","Internal Services","",0
"NSERC-SO0861","NSERC","Canada is a world leader in advancing, connecting and applying new knowledge in the natural sciences and engineering","",1
"NSERC-SO0862","NSERC","Discovery: High quality Canadian-based competitive research in the natural sciences and engineering","",0
"NSERC-SO0863","NSERC","Innovation: Knowledge and skills in the natural sciences and engineering are transferred to and used productively by the user sector in Canada","",0
"NSERC-SO0864","NSERC","People: Highly skilled science and engineering professionals in Canada","",0
"NSERC-SO1999","NSERC","Internal Services","",1
"OAG-SO0041","OAG","Through legislative auditing, we contribute to a well-managed and accountable government for Canadians","",1
"OCI-SO0941","OCI","The problems of offenders in the federal correctional system are identified and addressed in a timely fashion","",1
"OCI-SO1999","OCI","Internal Services","",1
"OCOL-SO0901","OCOL","Rights guaranteed by the Official Languages Act are protected and linguistic duality is promoted as a fundamental value of Canadian society","",1
"OCOL-SO1999","OCOL","Internal Services","",1
"OCSEC-SO0911","OCSEC","The Communications Security Establishment performs its duties and functions in accordance with the laws of Canada and with due regard for the privacy of Canadians","",1
"OCSEC-SO1999","OCSEC","Internal Services","",1
"ODPP-SO0951","ODPP","Criminal and regulatory offences under federal law are prosecuted in an independent, impartial and fair manner","",1
"ODPP-SO0952","ODPP","Compliance and enforcement activities under the Canada Elections Act and Referendum Act are conducted by the Commissioner of Canada Elections in an independent, impartial and fair manner","",1
"ODPP-SO1999","ODPP","Internal Services","",1
"OEC-SO0921","OEC","The public can feel confident that public office holders and members of Parliament are meeting the requirements of the conflict of interest compliance measures","",1
"OEC-SO1999","OEC","Internal Services","",1
"OICC-SO0881","OICC","Public Infrastructure for a More Prosperous Canada","",1
"OICC-SO0882","OICC","Funding for quality, cost-effective public infrastructure that meets the needs of Canadians in a competitive economy, a cleaner environment and liveable communities is provided","",0
"OICC-SO0883","OICC","Construction-ready infrastructure projects are provided with federal funding support","",0
"OICC-SO1999","OICC","Internal Services","",1
"OPSIC-SO0961","OPSIC","Wrongdoing in the federal public sector is addressed and public servants are protected in case of reprisal","",1
"OPSIC-SO1999","OPSIC","Internal Services","",1
"ORL-BVA00","ORL","Ensure transparency and accountability in the lobbying of public office holders in order to contribute to confidence in the integrity of government decision making","The purpose of the Lobbying Act and the Lobbyists’ Code of Conduct is to assure the Canadian public that lobbying is done transparently and with the highest ethical standards with a view to enhancing public confidence and trust in the integrity of government decision making. The mandate of the Commissioner of Lobbying is to establish and maintain the Registry of Lobbyists, develop and implement educational programs to foster awareness about the Act and the Code, and ensure compliance with the Act and the Code.",1
"ORL-ISS00","ORL","Internal Services","Internal Services are those groups of related activities and resources that the Federal Government considers to be services in support of programs and/or required to meet corporate obligations of an organization. Internal Services refer to the activities and resources of the ten distinct services that support program delivery in the organization, regardless of the Internal Services delivery model in a department. These services are Acquisition Management Services, Communications Services, Financial Management Services, Human Resources Management Services, Information Management Services, Information Technology Services, Legal Services, Materiel Management Services, Management and Oversight Services, Real Property Management Services.",1
"ORL-SO0891","ORL","Ensure transparency and accountability in the lobbying of public office holders in order to contribute to confidence in the integrity of government decision making","",0
"ORL-SO1999","ORL","Internal Services","",0
"OSEO-SO1191","OSEO","Senators meet their obligations under the Conflict of Interest Code in a manner that contributes to the integrity of the Senate as an institution","",1
"OSFI-SO0971","OSFI","A financially sound and sustainable Canadian public retirement income system","",1
"OSFI-SO0972","OSFI","A safe and sound Canadian financial system","",1
"OSFI-SO1999","OSFI","Internal Services","",1
"PACS-SO1061","PACS","To ensure fair and competency-based processes are in place for the recruitment and selection of qualified individuals for Governor-in-Council appointments across agencies, boards, commissions and Crown Corporations","",0
"PACS-SO1999","PACS","Internal Services","",0
"PCA-SO1001","PCA","Canadians have a strong sense of connection to their national parks, national historic sites, heritage canals, and national marine conservation areas and these protected places are experienced in ways that leave them unimpaired for the enjoyment of present and future generations","",1
"PCA-SO1999","PCA","Internal Services","",1
"PCC-SO1171","PCC","Public Confidence in the Royal Canadian Mounted Police","",1
"PCC-SO1999","PCC","Internal Services","",1
"PCO-SO1051","PCO","The Government's agenda and decision making are supported and implemented and the institutions of government are supported and maintained","",1
"PCO-SO1999","PCO","Internal Services","",1
"PHAC-SO1071","PHAC","Protecting Canadians and empowering them to improve their health","",1
"PHAC-SO1072","PHAC","Canada is able to promote health, reduce health inequalities, and prevent and mitigate disease and injury","",0
"PHAC-SO1999","PHAC","Internal Services","",1
"PMPRB-SO1031","PMPRB","Canadians are protected from excessive prices for patented medicines sold in Canada and stakeholders are informed on pharmaceutical trends","",1
"PMPRB-SO1999","PMPRB","Internal Services","",1
"PPP-SO1041","PPP","Transform Canada into a leader for public-private partnerships (P3)","",1
"PPS-SO1011","PPS","Physical security of Parliamentarians, employees, visitors, the premises or parts of premises that form part of the parliamentary Precinct and any assets located within or events that take place therein, and of Parliament Hill","",1
"PSC-SO1091","PSC","A highly competent, non-partisan and representative public service, able to provide service in both official languages, in which appointments are based on merit and the values of fairness, access, representativeness and transparency","",1
"PSC-SO1999","PSC","Internal Services","",1
"PSEP-SO1081","PSEP","A safe and resilient Canada","",1
"PSEP-SO1999","PSEP","Internal Services","",1
"PSSRB-SO1101","PSSRB","Resolution of labour relations issues in the federal public service and in Parliament in an impartial manner","",0
"PSSRB-SO1999","PSSRB","Internal Services","",0
"PSST-SO1111","PSST","Fair and impartial resolution of disputes related to internal appointments and lay offs in the federal public service","",0
"PSST-SO1999","PSST","Internal Services","",0
"RCMP-SO1155","RCMP","Canada's police provide international collaboration and assistance while maintaining a rich police heritage nationally","",1
"RCMP-SO1156","RCMP","Criminal activity affecting Canadians is reduced","",1
"RCMP-SO1157","RCMP","Incomes are secure for RCMP members and their survivors affected by disability or death","",1
"RCMP-SO1999","RCMP","Internal Services","",1
"RPSDP-SO1112","RPSDP","Fair and impartial resolution of disputes related to internal appointments and lay offs in the federal public service","",0
"RSCT-SO1141","RSCT","Efficient administration of the Specific Claims Tribunal","",0
"RSCT-SO1999","RSCT","Internal Services","",0
"SC-SO1231","SC","Canadians have access to timely, relevant and quality statistical information on Canada's changing economy and society for informed debate, research and decision making on social and economic issues","",1
"SC-SO1241","SC","Specific client needs for high-quality and timely statistical services are met","",1
"SC-SO1999","SC","Internal Services","",1
"SCA-SO1221","SCA","Canada has an effective and efficient National Standards System","",1
"SCC-SO1251","SCC","The administration of Canada's final court of appeal is effective and independent","",1
"SCC-SO1999","SCC","Internal Services","",1
"SEN-SO1281","SEN","To provide the best possible environment for Senators to effectively contribute to federal legislation and public policy issues in the best interest of all Canadians","",1
"SEN-SO1282","SEN","To enable the Senate to carry out its constitutional role and to administer the affairs of the Senate","",0
"SHARE-SO1201","SHARE","Modern, reliable, secure and cost-effective information technology (IT) infrastructure services to support government priorities and program delivery","",1
"SHARE-SO1999","SHARE","Internal Services","",1
"SIRC-SO1181","SIRC","Canadian Security Intelligence Service performs its duties and functions in accordance with the law, policy and ministerial direction","",1
"SIRC-SO1999","SIRC","Internal Services","",1
"SSHRC-SO1211","SSHRC","Canada has the institutional capacity to enable research and research-related activities in social sciences and humanities, natural sciences and engineering and health","",1
"SSHRC-SO1212","SSHRC","Canada is a world leader in social sciences and humanities research and research training","",1
"SSHRC-SO1213","SSHRC","Research: New knowledge based on excellent research in the social sciences and humanities","",0
"SSHRC-SO1214","SSHRC","Knowledge mobilization: Facilitating the use of social sciences and humanities knowledge within and beyond academia","",0
"SSHRC-SO1999","SSHRC","Internal Services","",1
"SWC-SO0931","SWC","Equality between women and men is promoted and advanced in Canada","",1
"SWC-SO0932","SWC","Equality for women and their full participation in the economic, social and democratic life of Canada","",0
"SWC-SO1999","SWC","Internal Services","",1
"TBC-BXA00","TBC","Spending Oversight","Review spending proposals and authorities; review existing and proposed government programs for efficiency, effectiveness and relevance; provide information to Parliament and Canadians on government spending.",1
"TBC-BXB00","TBC","Administrative Leadership","Lead government-wide initiatives; develop policies and set the strategic direction for government administration related to service delivery and access to government information, as well as the management of assets, finances, information and technology.",1
"TBC-BXC00","TBC","Employer","Develop policies and set the strategic direction for people management in the public service; manage total compensation (including pensions and benefits) and labour relations; undertake initiatives to improve performance in support of recruitment and retention objectives.",1
"TBC-BXD00","TBC","Regulatory Oversight","Develop and oversee policies to promote good regulatory practices, review proposed regulations to ensure they adhere to the requirements of Government policy, and advance regulatory cooperation across jurisdictions.",1
"TBC-ISS00","TBC","Internal Services","Internal Services are those groups of related activities and resources that the Federal Government considers to be services in support of programs and/or required to meet corporate obligations of an organization. Internal Services refer to the activities and resources of the ten distinct services that support program delivery in the organization, regardless of the Internal Services delivery model in a department. These services are Acquisition Management Services, Communications Services, Financial Management Services, Human Resources Management Services, Information Management Services, Information Technology Services, Legal Services, Materiel Management Services, Management and Oversight Services, Real Property Management Services.",1
"TBC-SO1311","TBC","Government is well managed and accountable, and resources are allocated to achieve results","",0
"TBC-SO1312","TBC","Good governance and sound stewardship to enable efficient and effective service to Canadians","",0
"TBC-SO1999","TBC","Internal Services","",0
"TC-SO1291","TC","A Clean Transportation System","",1
"TC-SO1292","TC","A Safe and Secure Transportation System","",1
"TC-SO1293","TC","An Efficient Transportation System","",1
"TC-SO1999","TC","Internal Services","",1
"TOUR-SO0381","TOUR","Canadian economy benefits from strong tourism demand from Canadian Tourism Commission's markets","",1
"TRC-SO0651","TRC","Disclosure and recognition of the truth regarding Indian Residential Schools furthers healing and reconciliation for the individuals and communities affected","",0
"TRC-SO1999","TRC","Internal Services","",0
"VAC-SO1321","VAC","Canadians remember and demonstrate their recognition of all those who served in Canada's efforts during war, military conflict and peace","",1
"VAC-SO1322","VAC","Financial, physical and mental well being of eligible Veterans","",1
"VAC-SO1323","VAC","Veterans' rights to services and benefits that address their needs are considered by the Veterans Affairs Portfolio","",1
"VAC-SO1324","VAC","Well-being of eligible Veterans and other clients","",0
"VAC-SO1999","VAC","Internal Services","",1
"VIA-SO1341","VIA","A national passenger rail transportation service that is safe, secure, efficient, reliable, and environmentally sustainable and that meets the needs of travellers in Canada","",1
"VRAB-SO1331","VRAB","An independent and fair appeal process for disability pension, award and allowance decisions made by Veterans Affairs Canada","",1
"WDBA-SO1361","WDBA","A safe, secure, and efficient international crossing for commercial and passenger traffic across the Windsor-Detroit Bridge","",1
"WDO-SO1351","WDO","A growing and diversified western Canadian economy","",1
"WDO-SO1352","WDO","The western Canadian economy is developed and diversified","",0
"WDO-SO1999","WDO","Internal Services","",1

