"ID","SubjectClass","subjectID","fyear1","fyear2","keys","footnote_fr"
111,"dept","FTRAC","2017-18","2017-18","EST_PROC","En 2017-2018, le Centre d'analyse des opérations et déclarations financières du Canada (CANAFE) continuera de fournir à ses partenaires, aux décideurs et à d'autres parties intéressées des renseignements financiers pertinents et exploitables, et qui contribuent à la sécurité publique des Canadiens. CANAFE continuera également de soutenir les efforts visant à prévenir l'utilisation abusive du système financier du Canada par les criminels et les groupes terroristes, et à réduire les perspectives de profit qui incitent au crime.


Dans le cadre de son mandat de conformité, CANAFE s'emploiera à prévenir le recyclage des produits de la criminalité et le financement des activités terroristes en améliorant la mesure dans laquelle les entités déclarantes se conforment à leurs obligations en matière de déclaration, de tenue de dossiers, de vérification de l'identité et autres exigences en vertu des parties 1 et 1.1 de la _Loi sur le recyclage des produits de la criminalité et le financement des activités terroristes_ et du règlement connexe.


En 2017-2018, CANAFE recevra un financement supplémentaire de 0,9 million de dollars pour les divulgations aux organismes provinciaux de réglementation des valeurs mobilières prévu dans le budget fédéral de 2015. Une diminution de 5,7 millions de dollars reflète le financement reçu dans le cadre du budget fédéral de 2014 pour la mise en oeuvre de modifications législatives et la modernisation de son système analytique. Une diminution supplémentaire de 0,7 million de dollars tient compte des réductions prévues dans le budget fédéral de 2016 et des rajustements du financement prévu par la loi.


Pour obtenir d'autres détails concernant CANAFE, ses opérations et l'utilisation de ses fonds, veuillez consulter le plan ministériel 2017-2018."
112,"dept","GG","2017-18","2017-18","EST_PROC","Le Bureau prévoit des dépenses budgétaires de 22,7 millions de dollars en 2017-2018. De cette somme, un montant de 19,7 millions de dollars doit être approuvé par le Parlement. Le solde de 3,0 millions de dollars représente les prévisions législatives, qui n'exigent pas d'approbation supplémentaire, et il est fourni à titre d'information seulement.


Comme annoncé dans le budget fédéral de 2015, le budget de fonctionnement du Bureau a augmenté pour inclure des dépenses afin d'appuyer et de moderniser le Système des distinctions honorifiques et de le rapprocher de tous les Canadiens. Ces améliorations prévues comprennent une hausse du nombre de nominations à l'Ordre du Canada des secteurs sous-représentés et la modernisation des critères d'admissibilité et de sélection pour un certain nombre d'honneurs et de distinctions. Il propose aussi de rapprocher les distinctions et les personnes honorées des Canadiens par la tenue d'événements et de cérémonies et la création d'un portail en ligne.


La différence des prévisions législatives par rapport à l'exercice précédent est attribuable aux rajustements, en vertu de la Loi sur le gouverneur général, aux paiements législatifs versés à l'actuel et aux anciens gouverneurs généraux et d'un rajustement des cotisations aux régimes d'avantages sociaux des employés."
113,"dept","GSC","2017-18","2017-18","EST_PROC","Travaux publics et Services gouvernementaux Canada (TPSGC) estime des dépenses budgétaires de 3 694,1 millions de dollars pour 2017-2018. De ce montant, 3 576,1 millions de dollars requiert l'approbation du Parlement. La portion restante, soit 118 millions de dollars, représente les autorités législatives ne nécessitant pas d'approbation additionnelle et est uniquement fournie à titre d'information.


Une augmentation des dépenses nettes de 823,6 millions de dollars, allant de 2 870,5 millions de dollars en 2016-2017 à 3 694,1 millions de dollars en 2017-2018, est essentiellement liée aux éléments suivants :
* 365,4 millions de dollars pour l'intégrité du programme des biens immobiliers pour la réparation et l'entretien des bâtiments fédéraux afin de fournir un lieu de travail sûr, sain et sécuritaire;
* 105,5 millions de dollars pour la réhabilitation de la Cité parlementaire afin de poursuivre la mise en oeuvre de la réhabilitation de la cité parlementaire qui vise à préserver les édifices du Parlement à titre de biens patrimoniaux et de symboles nationaux;
* 75,2 millions de dollars pour les ouvrages techniques pour réhabiliter de grandes infrastructures publiques, afin de réduire les risques liés à la santé et à la sécurité, et d'assurer l'intendance à long terme de ces actifs;
* 68,4 millions de dollars pour le projet d'acquisition de services énergétiques pour entreprendre une modernisation du réseau énergétique dans les centrales qui desservent les édifices fédéraux de la région de la capitale nationale;
* 35,7 millions de dollars pour le Plan d'action pour les sites contaminés fédéraux pour renouveler le soutien aux activités d'assainissement sur divers sites fédéraux contaminés dans le but de réduire les passifs correspondants et atténuer les risques pour la santé humaine et pour l'environnement;
* 21,9 millions de dollars pour les services d'acceptation des cartes et les frais postaux pour fournir aux organismes fédéraux la possibilité d'accepter les paiements électroniques des Canadiens et de soutenir l'augmentation des frais postaux causés par les fluctuations des prix et du volume des transactions.


Le programme de Gestion des locaux et des services immobiliers gère la subvention législative « Paiement en remplacement d'impôts fonciers versés aux municipalités et à d'autres autorités taxatrices », totalisant 594,6 millions de dollars, dont le montant est récupéré par TPSGC auprès des ministères ayant la garde des biens immobiliers."
114,"dept","H","2017-18","2017-18","EST_PROC","Grâce à des autorisations de 4,3 milliards de dollars prévues dans le cadre du budget principal des dépenses, Santé Canada continuera d'améliorer la qualité de vie de tous les Canadiens afin que la santé de la population canadienne soit l'une des meilleures du monde en matière de longévité, de style de vie et d'utilisation efficace du système public de soins de santé. Les autorisations totales de Santé Canada pour 2017-2018 représentent une augmentation nette de 511,8 millions de dollars par rapport au Budget principal des dépenses 2016-2017.


Cette augmentation du financement permettra d'appuyer les objectifs de Santé Canada et les priorités du gouvernement du Canada dans les domaines suivants :


Améliorer les résultats de santé pour les Premières Nations et les Inuits :
* financement pour mettre en oeuvre des réformes intérimaires des politiques fédérales liées au Principe de Jordan afin d'améliorer l'accès aux services sociaux et de santé des enfants des Premières Nations vivant dans les réserves;
* financement pour honorer les obligations du Canada en vertu de la Convention de règlement relative aux pensionnats indiens;
* financement pour fournir aux Premières Nations et aux Inuits un soutien immédiat et ciblé visant à favoriser leur bien être mental. 


Soutenir l'innovation dans le domaine des soins de santé et de la recherche médicale :
* financement destiné à l'Inforoute Santé du Canada pour mettre en oeuvre les technologies d'ordonnance électronique et le programme des télésoins à domicile;
* financement à la Fondation Brain Canada; 
* financement à la Fondation canadienne pour l'innovation dans le domaine des soins de santé.


Évaluer et aborder les effets sur la santé de l'environnement :
* financement pour soutenir la recherche scientifique sur les effets de la pollution atmosphérique sur la santé;
* financement pour soutenir les programmes sur l'adaptation aux changements climatiques afin d'atténuer les risques pour la santé.


Soutenir les investissements dans les infrastructures :
* financement pour effectuer des réparations des immobilisations, des projets d'expansion et de nouvelles constructions dans les installations sociales et de santé au sein des réserves;
* financement pour renouveler et améliorer les services de santé publique liés à l'approvisionnement en eau et au traitement des eaux usées dans les réserves;
* financement pour maintenir et mettre à niveau les infrastructures fédérales."
115,"dept","HC","2017-18","2017-18","EST_PROC","L'augmentation budgétaire est principalement attribuable à la hausse des budgets alloués aux députés et aux agents supérieurs de la Chambre, ainsi qu'à l'amélioration de la sécurité."
116,"dept","HRSD","2017-18","2017-18","EST_PROC","EDSC prévoit des dépenses budgétaires totalisant 57,4 milliards de dollars pour ses programmes et services en 2017-2018. Plus de 96 p. 100 des dépenses budgétaires prévues aideront directement la population canadienne par l'entremise du programme de la Sécurité de la vieillesse et d'autres programmes de paiements de transfert législatifs.


De cette somme, un montant de 2,4 milliards de dollars doit être approuvé par le Parlement. Le solde de 55,0 milliards de dollars représente les prévisions législatives qui ne nécessitent pas d'approbation supplémentaire, et il est fourni à titre d'information.


Les dépenses prévues pour 2017-2018 représentent une diminution de 2,2 milliards de dollars, ou d'environ 4 p. 100, comparativement aux dépenses réelles de 2015-2016, qui se chiffraient à 59,6 milliards de dollars. Cette diminution est attribuable en partie à une réduction de la Prestation universelle pour la garde d'enfants, qui a été remplacée par la nouvelle Allocation canadienne pour enfants. La diminution est compensée par une augmentation des paiements de la pension de la Sécurité de la vieillesse et du Supplément de revenu garanti en raison du vieillissement de la population et de la hausse prévue des versements mensuels moyens.


Comparativement aux dépenses budgétaires du Budget principal des dépenses 2016-2017, qui s'élevaient à 61,6 milliards de dollars, les dépenses prévues pour 2017-2018 constituent une diminution de 4,2 milliards de dollars, qui porte principalement sur des postes législatifs. Plus particulièrement, la Prestation universelle pour la garde d'enfants représente une diminution de 7,7 milliards de dollars. Cette importante diminution est compensée par des augmentations aux postes suivants :
* une augmentation de 2,8 milliards de dollars des versements de la pension de la Sécurité de la vieillesse et du Supplément de revenu garanti, qui s'explique par des changements apportés aux taux mensuels moyens et au nombre de bénéficiaires;
* une augmentation de 461,5 millions de dollars du Programme canadien de prêts et bourses aux étudiants et aux apprentis, principalement en raison d'une hausse des bourses canadiennes aux fins d'études découlant des mesures du budget fédéral de 2016 en vue de rendre les études postsecondaires plus abordables pour les étudiants de famille à revenu faible ou moyen;
* une augmentation de 107,0 millions de dollars des dépenses prévues pour les Subventions canadiennes pour l'épargne-invalidité et les Bonds canadiens pour l'épargne-invalidité, en raison de la hausse constante de l'ensemble des régimes enregistrés d'épargne-invalidité et de la participation accrue au programme.


Le Ministère prévoit dépenser 576,8 millions de dollars en 2017-2018 en dépenses de fonctionnement nettes (crédit 1), ce qui représente une diminution de 31,2 millions de dollars par rapport aux 608,0 millions de dollars inscrits au Budget principal des dépenses 2016-2017. Cette diminution nette est principalement liée à une réduction des ressources pour le Programme des travailleurs étrangers temporaires.


Les subventions et contributions votées (crédit 5) devraient atteindre 1,8 milliard de dollars en 2017-2018, ce qui représente une augmentation de 154,1 millions de dollars comparativement au Budget principal des dépenses 2016-2017. L'augmentation est principalement attribuable aux investissements annoncés dans le budget fédéral de 2016 relatifs au programme Emplois d'été Canada et à la Stratégie des partenariats de lutte contre l'itinérance.


Quant aux prêts non budgétaires, on constate une diminution nette de 621,2 millions de dollars par rapport aux autorisations inscrites au Budget principal des dépenses 2016-2017, principalement en raison des mesures du budget fédéral de 2016 qui auront pour effet d'augmenter le versement des bourses et de réduire les prêts consentis puisqu'un plus grand nombre d'emprunteurs verront leurs besoins financiers comblés par la hausse des bourses."
117,"dept","IDRC","2017-18","2017-18","EST_PROC","Le Centre de recherches pour le développement international prévoit des dépenses budgétaires de 138,7 millions de dollars en 2017-2018, qui doivent être approuvées par le Parlement.


La diminution de 10,5 millions de dollars des crédits par rapport au budget principal des dépenses 2016-2017, s'explique par :
* une diminution de 11,0 millions de dollars attribuable à la fin du Fonds d'innovation pour le développement, qui avait pour but d'appuyer la recherche en santé mondiale de pointe susceptible d'améliorer les conditions de vie des populations pauvres des pays en développement, et ce, en mobilisant le milieu scientifique afin qu'il s'attaque aux priorités en matière de recherche en santé mondiale et en encourageant l'utilisation des résultats de la recherche en vue de résoudre des problèmes de développement;
* une augmentation de 0,5 million de dollars liée aux fonds provenant des Instituts de recherche en santé du Canada pour le programme Innovation pour la santé des mères et des enfants d'Afrique."
118,"dept","IJC","2017-18","2017-18","EST_PROC","La Commission mixte internationale (CMI), afin de s'acquitter du mandat qui lui est confié aux termes du Traité des eaux limitrophes, continue d'élaborer et de mettre en oeuvre des outils et des approches scientifiques dans le cadre de son Initiative internationale sur les bassins hydrographiques en vue d'aider les gouvernements à prévoir, à prévenir et à régler les questions relatives à l'eau à l'échelle locale.


En font partie :
* une augmentation de 3,3 millions de dollars comparativement au Budget principal des dépenses 2016-2017 en raison de la mise en œuvre des affectations à la CMI prévues dans le budget fédéral de 2016 relativement à la poursuite d'étude de plans, y compris les bassins du lac Champlain, de la rivière Richelieu et de la rivière Souris aux fins de prévision, de gestion et d'atténuation des inondations;
* l'harmonisation des données hydrographiques dans les bassins transfrontaliers dont la date d'achèvement cible correspond à juin 2017;
* l'achèvement, d'ici l'été 2017, du projet binational de modélisation de l'information sur la qualité de l'eau dans les bassins des Grands Lacs et de la rivière à la Pluie et au lac des Bois;
* la mise en oeuvre d'une approche de gestion adaptative à la régulation des niveaux d'eau dans le réseau hydrographique des Grands Lacs et du Saint-Laurent, en prenant en considération les changements climatiques;
* l'accroissement de l'efficacité des activités de la CMI, particulièrement dans les domaines de la gestion de l'information et de la technologie de l'information;
* l'accroissement de la sensibilisation du public et des efforts de communication, par l'entremise d'un site Web amélioré, plus fiable et interactif.


Conformément à sa responsabilité de maintenir la réglementation efficace de certaines eaux frontalières et transfrontalières et au rôle précis qui lui est confié dans la Convention sur le lac à la Pluie de 1938, la CMI examine son ordonnance sur la régularisation des niveaux d'eau dans le système des lacs à la Pluie et Namakan. Afin d'éclairer cet examen, plus de 20 études parrainées par la CMI sont analysées en vue d'alimenter l'élaboration d'éventuelles solutions de rechange en matière de réglementation. Des consultations approfondies menées auprès du public et d'intervenants, y compris des séances exclusives pour les Premières Nations, les Métis et les tribus sont menées dans le bassin.
La CMI prendra en considération les recommandations fondées sur l'évaluation de l'étude et les commentaires du public au cours de l'été 2017, avant la tenue d'audiences publiques officielles sur le bassin. 


Elle s'acquitte du rôle qui lui est assigné dans l'Accord relatif à la qualité de l'eau dans les Grands Lacs. En particulier, la CMI accomplira ce qui suit :
* recueillir et résumer les commentaires du public sur le Rapport d'étape des Parties;
* produire une évaluation triennale du rapport d'étape;
* consulter le public sur des questions touchant la qualité de l'eau dans les Grands Lacs, surtout dans la mesure où elles touchent l'évaluation des progrès réalisés;
* continuer de formuler des conseils sur des questions scientifiques liées à l'écosystème du bassin des Grands Lacs et produire des rapports spéciaux portant sur la qualité des eaux des Grands Lacs."
119,"dept","INAC","2017-18","2017-18","EST_PROC","AANC prévoit des dépenses budgétaires et non budgétaires de 10,1 milliards de dollars en 2017-2018. De ce montant, 9,9 milliards de dollars requièrent l'approbation du Parlement. Le solde correspond aux prévisions législatives qui ne nécessitent pas d'approbation supplémentaire; et il est fourni à titre d'information.


L'augmentation nette des dépenses budgétaires et non budgétaires d'environ 2,6 milliards de dollars, soit 34 p.100 par rapport au Budget principal des dépenses 2016-2017, reflète principalement les investissements historiques prévus dans le budget fédéral de 2016 ainsi que les changements au profil des ressources destinées à des initiatives ciblées :
* une augmentation de 540,2 millions de dollars du flux de trésorerie destiné à la négociation, au règlement et à la mise en oeuvre des revendications particulières et globales (principalement une augmentation du financement pour des revendications particulières afin de tenir compte du niveau de règlement anticipé);
* une augmentation de 416,4 millions de dollars visant à appuyer la prestation des services d'eau potable et d'eaux usées dans les réserves des Premières Nations ainsi que les infrastructures de gestion des déchets solides dans les réserves (budget fédéral de 2016);
* une augmentation de 320,4 millions de dollars pour des investissements supplémentaires pour l'éducation primaire et secondaire des Premières Nations (budget fédéral de 2016);
* une augmentation de 304,2 millions de dollars pour des projets liés au logement abordable et à l'infrastructure sociale (budget fédéral de 2016);
* une augmentation de 282,5 millions de dollars afin de soutenir le Fonds accru pour l'infrastructure scolaire des Premières Nations (budget fédéral de 2016);
* une augmentation de 273,3 millions de dollars pour l'évaluation, la gestion et l'assainissement des sites contaminés fédéraux;
* une augmentation de 149,4 millions de dollars afin d'aider les collectivités des Premières Nations à construire des infrastructures publiques dans les réserves par l'intermédiaire du Fonds d'infrastructure des Premières Nations (budget fédéral de 2016);
* une augmentation de 98,5 millions de dollars pour soutenir les investissements urgents dans le Programme des services à l'enfance et à la famille des Premières Nations (budget fédéral de 2016).


Pour plus de renseignements concernant les plans et les priorités du Ministère, veuillez consulter le plan ministériel 2017-2018."
120,"dept","IPC","2017-18","2017-18","EST_PROC","**COMMISSARIAT À LA PROTECTION DE LA VIE PRIVÉE DU CANADA**
Le Commissariat à la protection de la vie privée du Canada (CPVP) prévoit des dépenses budgétaires de 24,34 millions de dollars en 2017-2018, ce qui est identique à l'exercice précédent. De cette somme, un montant de 22,07 millions de dollars doit être approuvé par le Parlement. Le solde de 2,27 millions de dollars représente les prévisions législatives qui ne nécessitent pas d'approbation supplémentaire, et il est fourni à titre d'information.


Le financement permanent du CPVP en 2017-2018 et pour les années futures restera stable et servira à mener à bien les efforts et les activités du CPVP en vue de réaliser l'unique résultat stratégique du CPVP, à savoir que le droit des individus à la vie privée est protégé, ainsi que les priorités de l'organisation pour 2017-2018 :
• faire progresser les nouvelles priorités pour la protection de la vie privée;
• appuyer les initiatives du gouvernement et du Parlement visant à réformer la législation fédérale sur la protection des renseignements;
• renforcer la capacité et la souplesse organisationnelles;
• améliorer les possibilités de partenariat stratégique et de collaboration.


**COMMISSARIAT À L'INFORMATION DU CANADA**
Le Commissariat à l'information du Canada (le Commissariat) prévoit des dépenses budgétaires de 11,19 millions de dollars en 2017-2018. De cette somme, un montant de 9,95 millions de dollars doit être approuvé par le Parlement. Le solde de 1,25 million de dollars représente les prévisions législatives qui ne nécessitent pas d'approbation supplémentaire, et il est fourni à titre d'information.


Le Commissariat prévoit des dépenses budgétaires de 11,19 millions de dollars dans le Budget principal des dépenses 2017-2018, ce qui correspond à une diminution de 115 899 $ par rapport à l'exercice précédent en raison d'une réduction du taux du Régime d'avantages sociaux des employés, qui est passé de 17,2 p. 100 à 15,7 p. 100 et une augmentation de 19 298 $ associée aux négociations collectives.


En 2017-2018, le financement servira avant tout à mener des enquêtes efficaces, justes et  confidentielles sur des plaintes ou problèmes concernant la façon dont les institutions fédérales traitent les demandes d'accès à l'information provenant du public. D'autres activités seront menées pour appuyer la commissaire dans son rôle consultatif auprès du Parlement sur toutes les questions relatives à l'accès à l'information. Au besoin, le personnel du Commissariat aidera également la commissaire à porter les questions d'interprétation et d'application de la Loi devant les tribunaux."
121,"dept","IRB","2017-18","2017-18","EST_PROC","La Commission de l'immigration et du statut de réfugié prévoit des dépenses budgétaires de 127,1 millions de dollars en 2017-2018. De ce montant, la somme de 113,2 millions de dollars doit être approuvée par le Parlement. Le solde de 13,8 millions de dollars représente les prévisions législatives qui ne nécessitent pas d'approbation, et il est fourni à titre d'information.


Le Budget principal des dépenses 2017-2018 présente une augmentation globale de 12,6 millions de dollars ou de 11 p. 100 par rapport à celui de 2016-2017. Cette augmentation est principalement attribuable à :
* une augmentation de 13,2 millions de dollars du financement temporaire pour les dépenses de fonctionnement associées à la résolution de cas à la suite de la levée de l'obligation du visa pour le Mexique, exemptant ainsi les citoyens mexicains de présenter une demande de visa de résident temporaire, ce qui entraînera une augmentation prévue du nombre de demandeurs d'asile;
* une diminution de 0,9 million de dollars découlant des mesures de réduction annoncées dans le budget fédéral de 2016;
* une augmentation nette de 0,3 million de dollars des coûts des avantages sociaux des employés et du financement de conventions collectives particulières.


Des renseignements supplémentaires se trouvent dans le plan ministériel 2017-2018."
