"ID","SubjectClass","subjectID","fyear1","fyear2","keys","footnote_fr"
1,"dept","CEAA","","","PLANNED_EXP","Les dépenses pour le programme de réalisation d'évaluations environnementales n'incluent pas les dépenses recouvrables. L'Agence est autorisée à recouvrer jusqu'à 8 millions de dollars par année, somme qui est déduite de l'autorisation votée."
2,"dept","CEAA","2016-17","","PLANNED_EXP","Les dépenses pour le programme de réalisation d'évaluations environnementales n'incluent pas les dépenses recouvrables. L'Agence est autorisée à recouvrer jusqu'à 8 millions de dollars par année, somme qui est déduite de l'autorisation votée."
3,"dept","FIN","2017-18","2019-20","PROG","Le programme de paiements de transfert et d'impôt est présenté sous la forme de cinq programmes distincts afin de montrer sa contribution aux différents secteurs d'activités du gouvernement. Les dépenses et les ETP prévus pour le programme de paiements de transfert et d'impôt totaliseront, respectivement, pour les trois prochains exercices:
* 2017-2018 : 68 450 488 707 dollars et 11 ETP
* 2018-2019 : 70 551 481 211 dollars et 11 ETP
* 2019-2020 : 73 069 931 181 dollars et 11 ETP"
4,"dept","HRSD","2017-18","2017-18","PLANNED_EXP","Contrairement à la majorité des organisations, le financement d’EDSC n’est pas simplement dérivé du Trésor. EDSC a aussi l’autorité de recouvrir ses coûts du :
* Compte des opérations de l’assurance-emploi,
* Compte de Régime de pensions du Canada, 
* Fonds renouvelable de Passeport Canada. 


Comme ces autres sources de fonds ne sont pas comprises dans le grand total aux Comptes publics des dépenses budgétaires du gouvernement, elles ne sont pas comprises dans l’InfoBase du GC. Pour trouver des détails additionnels concernant ces éléments ne provenant pas du Trésor, veuillez-vous référer au Plan ministériel d’EDSC qui comprend l’information concernant toutes les sources de financement du ministère."
5,"dept","ND","2012-13","","PLANNED_FTE, FTE","Le total des ETP inclus la Force régulière et les civils"
6,"program","FIN-BLJ01","2017-18","2019-20","PROG","Le programme de paiements de transfert et d'impôt est présenté sous la forme de cinq programmes distincts afin de montrer sa contribution aux différents secteurs d'activités du gouvernement. Les dépenses et les ETP prévus pour le programme de paiements de transfert et d'impôt totaliseront, respectivement, pour les trois prochains exercices:
* 2017-2018 : 68 450 488 707 dollars et 11 ETP
* 2018-2019 : 70 551 481 211 dollars et 11 ETP
* 2019-2020 : 73 069 931 181 dollars et 11 ETP"
7,"program","FIN-BLJ02","2017-18","2019-20","PROG","Le programme de paiements de transfert et d'impôt est présenté sous la forme de cinq programmes distincts afin de montrer sa contribution aux différents secteurs d'activités du gouvernement. Les dépenses et les ETP prévus pour le programme de paiements de transfert et d'impôt totaliseront, respectivement, pour les trois prochains exercices:
* 2017-2018 : 68 450 488 707 dollars et 11 ETP
* 2018-2019 : 70 551 481 211 dollars et 11 ETP
* 2019-2020 : 73 069 931 181 dollars et 11 ETP"
8,"program","FIN-BLJ06","2017-18","2019-20","PROG","Le programme de paiements de transfert et d'impôt est présenté sous la forme de cinq programmes distincts afin de montrer sa contribution aux différents secteurs d'activités du gouvernement. Les dépenses et les ETP prévus pour le programme de paiements de transfert et d'impôt totaliseront, respectivement, pour les trois prochains exercices:
* 2017-2018 : 68 450 488 707 dollars et 11 ETP
* 2018-2019 : 70 551 481 211 dollars et 11 ETP
* 2019-2020 : 73 069 931 181 dollars et 11 ETP"
9,"program","FIN-BLJ09","2017-18","2019-20","PROG","Le programme de paiements de transfert et d'impôt est présenté sous la forme de cinq programmes distincts afin de montrer sa contribution aux différents secteurs d'activités du gouvernement. Les dépenses et les ETP prévus pour le programme de paiements de transfert et d'impôt totaliseront, respectivement, pour les trois prochains exercices:
* 2017-2018 : 68 450 488 707 dollars et 11 ETP
* 2018-2019 : 70 551 481 211 dollars et 11 ETP
* 2019-2020 : 73 069 931 181 dollars et 11 ETP"
10,"program","FIN-BLJ11","2017-18","2019-20","PROG","Le programme de paiements de transfert et d'impôt est présenté sous la forme de cinq programmes distincts afin de montrer sa contribution aux différents secteurs d'activités du gouvernement. Les dépenses et les ETP prévus pour le programme de paiements de transfert et d'impôt totaliseront, respectivement, pour les trois prochains exercices:
* 2017-2018 : 68 450 488 707 dollars et 11 ETP
* 2018-2019 : 70 551 481 211 dollars et 11 ETP
* 2019-2020 : 73 069 931 181 dollars et 11 ETP"
11,"dept","CT","2013-14","2013-14","AUTH, EXP","L'écart entre les dépenses réelles effectuées en 2012-2013 et en 2013-2014 est attribuable aux dépenses directes au titre des audiences tenues par le Tribunal. En 2012-2013, le Greffe a dû affecter beaucoup de ressources à deux audiences d'importance majeure, tandis qu'en 2013-2014, beaucoup moins de jours ont été consacrés à des audiences."
12,"dept","NR","","2012-13","AUTH, EXP","Le ministère des Ressources naturelles (RNCan) a connu une hausse importante du financement temporaire 2008-2009 et 2011-2012, découlant principalement des programmes annoncés dans le cadre du Plan d'action économique du Canada 2009, y compris le Programme d'écologisation des pâtes et papiers et le programme des subventions écoÉNERGIE Rénovation – Maisons."
13,"dept","PSEP","2013-14","2013-14","AUTH, EXP","Le plus remarquable, c'est l'augmentation considérable des dépenses pour l'exercice de 2013-2014 lorsqu'on les compare à celles de 2012-2013 qui est principalement due aux dépenses pour le programme de contributions des Accords d'aide financière en cas de catastrophe et pour l'aide financière fournie à la province de Québec pour les coûts d'intervention et de rétablissement liés à l'explosion qui a suivi le déraillement de train à Lac-Mégantic, au Québec."
14,"dept","ACOA","2011-12","2012-13","EXP, AUTH","En raison du retard de certains projets, il y a des fonds qui non pas été dépensés au cours des exercices 2011-2012 et 2012-2013."
15,"dept","ACOA","2017-18","2019-20","PLANNED_EXP, PLANNED_FTE, FTE","Les dépenses prévues de l’APECA liées à son financement et fonctionnement de base demeureront inchangées au cours des prochaines années. Les écarts des dépenses prévues pour les prochaines années reflètent la fin d’initiatives de financement temporaires comme le PIC 150, ainsi que les autorisations en cours d’exercice qui sont liées aux sommes des contributions remboursables qui n’ont pas encore été perçues. Le nombre d’ETP à l’APECA s’est stabilisé à environ 590 depuis 2014-2015. De petites fluctuations continueront d’avoir lieu annuellement en raison du roulement du personnel et de la redistribution des ressources pour appuyer les priorités et les projets. L’Agence continuera d’atteindre ses résultats en affectant ses ETP aux tâches qui lui permettront de mieux appuyer ses programmes."
16,"dept","AGR","2011-12","2015-16","EXP","Les dépenses totales d’Agriculture et Agroalimentaire Canada ont diminué de 2011-2012 à 2015-2016, car les chiffres pour l’exercice 2011-2012 tenaient compte de l’aide en cas de catastrophe versée aux producteurs touchés par les conditions d’humidité excessive dans les provinces de l’Ouest et au Québec et de l’aide fournie aux éleveurs qui ont manqué de fourrage à cause de la sécheresse. Les besoins en subventions et en contributions législatives au titre des programmes de gestion des risques de l’entreprise ont été moins importants en 2015-2016. Des économies ont également été réalisées pendant cet exercice en raison de la restructuration organisationnelle mené par le gouvernement."
17,"dept","AGR","2011-12","2019-20","EXP","Les dépenses totales d’Agriculture et Agroalimentaire Canada ont diminué de 2011-2012 à 2015-2016, car les chiffres pour l’exercice 2011-2012 tenaient compte de l’aide en cas de catastrophe versée aux producteurs touchés par les conditions d’humidité excessive dans les provinces de l’Ouest et au Québec et de l’aide fournie aux éleveurs qui ont manqué de fourrage à cause de la sécheresse. Les besoins en subventions et en contributions législatives au titre des programmes de gestion des risques de l’entreprise ont été moins importants en 2015-2016. Des économies ont également été réalisées pendant cet exercice en raison de la restructuration organisationnelle mené par le gouvernement.

"
18,"dept","AGR","2017-18","2019-20","PLANNED_EXP","La diminution des dépenses prévues en 2018-2019 et 2019-2020 témoigne du fait qu’il faudra renouveler les autorisations fédérales associées à l’ensemble de programmes de gestion des risques de l’entreprise de même qu’aux programmes courants non liés à la gestion des risques de l’entreprise de Cultivons l’avenir 2 lorsque le cadre quinquennal prendra fin en 2017-2018. Agriculture et Agroalimentaire Canada, de concert avec les provinces et les territoires, est en train de finaliser le cadre stratégique qui remplacera Cultivons l’avenir 2 pour aider les agriculteurs et les transformateurs d’aliments du Canada à développer leurs entreprises."
19,"dept","CCRA","2011-12","2015-16","SOBJ","Une partie importante des dépenses déclarées dans le cadre des Services internes est associée au travail relié aux technologies de l'information et comprend les activités menées pour le compte des programmes afin d'assurer la durabilité continue des systèmes de l’ARC."
20,"dept","CEO","2011-12","2019-20","PLANNED_EXP, EXP, AUTH, SOBJ","Le profil global des dépenses du Bureau du directeur générale des élection est le résultat du cycle électoral. Les dépenses augmentent au cours de l'exercice où se tient une élection générale."
21,"dept","CEO","2011-12","2019-20","PLANNED_FTE, FTE","Le profil global d'utilisation d'ETP de du Bureau du directeur générale est le résultat du cycle électoral.  Le nombre d'ETP augmente au cours de l'exercice où se tient une élection générale"
22,"dept","CFGB","2011-12","2015-16","EXP, AUTH","La principale raison en est que pendant la plupart du temps durant cinq années, il y avait plusieurs postes vacants de membres du Comité. Les membres du Comité sont nommés par le gouverneur en conseil."
23,"dept","CNEDA","2011-12","2015-16","PEOPLE","Avant mars 2014, l'information concernant le nombre d'employés est agrégée avec celle des Affaires autochtones et du Nord Canada"
24,"dept","CNEDA","2017-18","2019-20","PLANNED_EXP","La majeure partie de la diminution globale des ressources financières en 2017-18 est attribuable à l’arrivée à terme du programme d’Investissements stratégiques dans le développement économique du Nord (19,8 millions de dollars) et du Programme d’infrastructure communautaire de Canada 150 (6,4 millions de dollars). Des décisions concernant l’extension, la réduction ou l’amélioration des programmes et du financement seront reflétées dans les futurs exercices budgétaires et le budget principal des dépenses."
25,"dept","CTAIB","2013-14","2013-14","EXP","Augmentation des dépenses pour 2013-2014 est en raison de l'enquête Lac-Mégatic pour laquelle des fonds spéciaux ont été reçus par le ministère"
26,"dept","FORDQ","2011-12","2019-20","PLANNED_EXP, EXP, SOBJ","Dès 2012-2013, l'Agence de dévelopment économique Canada pour les régions du Québec (DEC) connaît une diminution significative de ses dépenses réelles en services internes.  Cette baisse est le résultat des efforts de l’organisation pour respecter les orientations gouvernementales liées à la réduction du déficit.  Les fluctuations budgétaires en subventions et contributions de DEC s’expliquent essentiellement par l’ajout ou la fin de certaines initiatives temporaires confiées à DEC s’échelonnant sur une ou plusieurs années.  Ces initiatives temporaires se retrouvent à même le programme « Renforcement de l’économie des collectivités ». 
Les programmes de DEC sont flexibles de façon à s’adapter en continu aux défis et aux enjeux des entreprises et des différentes régions du Québec. Pour y parvenir, DEC procède annuellement à une réallocation, à l’interne, des ressources financières disponibles entre ses différents programmes.
Le réinvestissement des revenus tirés du remboursement des contributions remboursables par les clients n'est pas inclus aux 2 dernières années de planification financière; les autorisations n’étant pas obtenues au moment de la préparation des informations budgétaires."
27,"dept","ISC","2011-12","2015-16","SOBJ10","La diminution des dépenses dans le cadre de l’Initiative stratégique pour l’aérospatiale et la défense (ISAD) de 2012-2013 à 2015-2016 est surtout attribuable au fait que la demande était inférieure à ce qui avait été prévu, ce qui a eu une incidence directe sur le nombre de projets approuvés et les dépenses totales en cours d’exercice."
28,"dept","ISC","2011-12","2015-16","SOBJ10","
Les diminutions relatives au paiement de transfert Programme d’infrastructure du savoir (PIS) reflètent le versement des fonds tout au long du programme. Le PIS a maintenant pris fin officiellement.  
"
29,"dept","ISC","2011-12","2015-16","SOBJ10","L’engagement financier de quatre ans annoncé dans le budget de 2009 pour le programme CSeries de Bombardier a pris fin en 2014-2015. Depuis, un financement supplémentaire a été fourni, à compter de 2016-2017."
30,"dept","ISC","2011-12","2015-16","SOBJ10","
L’augmentation des dépenses dans le cadre du Fonds d’innovation pour le secteur de l’automobile (FISA) est attribuable aux fonds additionnels reçus en 2015-2016 par l’entremise du Budget supplémentaire des dépenses (B) en vue d’appuyer des projets de recherche et développement de grande envergure dans le secteur de l’automobile grâce au FISA, notamment l’avancement de véhicules plus verts et plus économiques.
"
31,"dept","ISC","2011-12","2015-16","SOBJ10","
L’augmentation des dépenses dans le cadre du paiement de transfert pour la Fondation canadienne pour l’innovation est attribuable à un financement supplémentaire de 500 millions de dollars sur cinq ans, à compter de 2014-2015, accordé dans le budget de 2012.
"
32,"dept","ISC","2011-12","2015-16","SOBJ10","La hausse des dépenses pour le paiement de transfert Un Canada branché est attribuable à un nouveau financement provenant du budget de 2014. Le financement continuera d’être versé jusqu’en 2018-2019. 

"
33,"dept","ISC","2011-12","2015-16","SOBJ10,SOBJ","La diminution observée dans les paiements de transfer entre 2011-2012 et 2013-2014 s’explique par la fin du financement qui était accordé dans le budget de 2009. Les dépenses liées aux programmes de paiements de transfert ont commencé à augmenter en 2014-2015 et ont augmenté de nouveau en 2015-2016, reflétant le nouveau financement pour le programme Un Canada branché, le Programme de démonstration de technologies, le Fonds d’innovation pour le secteur de l’automobile et le Programme d’innovation pour les fournisseurs du secteur de l’automobile."
34,"dept","PSC","2015-16","2015-16","SOBJ","Durant l’exercice financier 2015-2016, le plus important programme de la Commission de la fonction publique du Canada en termes de dépenses brutes était « Services de dotation et d’évaluation » (28,8 millions de dollars), suivi de « Services internes » (24,7 millions de dollars). Les dépenses des services internes représentaient 30 pourcent des dépenses brutes de la Commission de la fonction publique du Canada."
35,"dept","PSEP","2011-12","2019-20","PLANNED_EXP, EXP","Les dépenses en subventions et contributions de Sécurité Publique sont sujettes à des écarts significatifs d'une année à l'autre due à un plus grand niveau de risque et d'incertitude. Ceci est relié à un de ses plus larges programmes, le programme de contribution des Accords d’aide financière en cas de catastrophe (AAFCC), sujet à des événements imprévus telles que les catastrophes naturelles."
36,"dept","PSEP","2013-14","2015-16","AUTH, EXP","L'augmentation considérable des autorisations non-dépensées en 2014-2015 et 2015-16 lorsque comparée à 2013-2014 est principalement due à des demandes de paiements différées par les provinces dans le cadre du programme de contribution des Accords d’aide financière en cas de catastrophe (AAFCC)."
37,"dept","SC","2011-12","2015-16","EXP, SOBJ","Les dépenses varient d'une année à l'autre découlant de la nature cyclique du programme des recensements. Ceci est particulièrement prononcé dans les dépenses liées au personnel, transports et communications et services professionnels et spéciaux."
38,"dept","SC","2017-18","2019-20","PLANNED_EXP","Les dépenses planifiées varient d'une année à l'autre découlant de la nature cyclique du programme des recensements. Les dépenses réelles suivent le même modèle."
39,"program","AGR-ISC00","2011-12","2019-20","EXP, PLANNED_EXP","Les dépenses des services internes d’Agriculture et Agroalimentaire Canada ont diminué de 2011-2012 à 2015-2016 en raison de la redistribution des ressources entre les programmes et des montants transférés aux autres ministères du gouvernement afin de regrouper et de transformer l’infrastructure de la technologie de l’information et les fonctions relatives à la paye à l’échelle du gouvernement. La baisse prévue des dépenses en 2018-2019 et 2019-2020 découle de l’arrivée à expiration des autorisations de financement du cadre stratégique quinquennal Cultivons l’avenir 2 à la fin de 2017 2018. Un nouveau cadre stratégique est en cours de finalisation."
40,"program","AGR-ISC00","2011-12","2019-20","PLANNED_EXP, EXP","Les dépenses des services internes d’Agriculture et Agroalimentaire Canada ont diminué de 2011-2012 à 2015-2016 en raison de la redistribution des ressources entre les programmes et des montants transférés aux autres ministères du gouvernement afin de regrouper et de transformer l’infrastructure de la technologie de l’information et les fonctions relatives à la paye à l’échelle du gouvernement. La baisse prévue des dépenses en 2018-2019 et 2019-2020 découle de l’arrivée à expiration des autorisations de financement du cadre stratégique quinquennal Cultivons l’avenir 2 à la fin de 2017 2018. Un nouveau cadre stratégique est en cours de finalisation."
41,"program","CCRA-ISC00","2011-12","2015-16","AUTH, EXP,SOBJ","Une partie importante des dépenses déclarées dans le cadre des Services internes est associée au travail relié aux technologies de l'information et comprend les activités menées pour le compte des programmes afin d'assurer la durabilité continue des systèmes de l’ARC."
42,"program","CCRA-ISC00","2011-12","2015-16","FTE","A significant portion of the FTEs reported under Internal Services is associated with Information Technology work and includes activities carried out on behalf of the programs to ensure the continued sustainability of CRA systems."
43,"program","CEO-HGG00","2011-12","2019-20","PLANNED_EXP, EXP, AUTH, SOBJ","Le profil global des dépenses du Bureau du directeur générale des élection est le résultat du cycle électoral. Les dépenses augmentent au cours de l'exercice où se tient une élection générale."
44,"program","CEO-HGG00","2011-12","2019-20","PLANNED_FTE, FTE","Le profil global d'utilisation d'ETP de du Bureau du directeur générale est le résultat du cycle électoral.  Le nombre d'ETP augmente au cours de l'exercice où se tient une élection générale"
45,"program","CEO-HGI00","2011-12","2019-20","PLANNED_EXP, EXP, AUTH, SOBJ","Le profil global des dépenses du Bureau du directeur générale des élection est le résultat du cycle électoral. Les dépenses augmentent au cours de l'exercice où se tient une élection générale."
46,"program","CEO-HGI00","2011-12","2019-20","PLANNED_FTE, FTE","Le profil global d'utilisation d'ETP de du Bureau du directeur générale est le résultat du cycle électoral.  Le nombre d'ETP augmente au cours de l'exercice où se tient une élection générale"
47,"program","CEO-HGJ00","2011-12","2019-20","PLANNED_EXP, EXP, AUTH, SOBJ","Le profil global des dépenses du Bureau du directeur générale des élection est le résultat du cycle électoral. Les dépenses augmentent au cours de l'exercice où se tient une élection générale."
48,"program","CEO-HGJ00","2011-12","2019-20","PLANNED_FTE, FTE","Le profil global d'utilisation d'ETP de du Bureau du directeur générale est le résultat du cycle électoral.  Le nombre d'ETP augmente au cours de l'exercice où se tient une élection générale"
49,"program","CEO-ISC00","2011-12","2019-20","PLANNED_EXP, EXP, AUTH, SOBJ","Le profil global des dépenses du Bureau du directeur générale des élection est le résultat du cycle électoral. Les dépenses augmentent au cours de l'exercice où se tient une élection générale."
50,"program","CEO-ISC00","2011-12","2019-20","PLANNED_FTE, FTE","Le profil global d'utilisation d'ETP de du Bureau du directeur générale est le résultat du cycle électoral.  Le nombre d'ETP augmente au cours de l'exercice où se tient une élection générale"
51,"program","CNEDA-CLA00","2017-18","2019-20","PLANNED_EXP","La majeure partie de la diminution globale des ressources financières en 2017-18 est attribuable à l’arrivée à terme du programme d’Investissements stratégiques dans le développement économique du Nord (19,8 millions de dollars) et du Programme d’infrastructure communautaire de Canada 150 (6,4 millions de dollars). Des décisions concernant l’extension, la réduction ou l’amélioration des programmes et du financement seront reflétées dans les futurs exercices budgétaires et le budget principal des dépenses."
52,"program","CRTC-ISC00","2015-16","2015-16","EXP","Ces dépenses sont nettes des recette disponible du Conseil de la radiodiffusion et des télécommunications canadiennes (CRTC).  Ces recette comptent pour approximativement 80% des dépenses du CRTC.  Ainsi, les dépense de 2015-16 au Services internes sont de $14,007,553."
53,"program","FORDQ-ISC00","2011-12","2015-16","EXP","Dès 2012-2013, l'Agence de dévelopment économique Canada pour les régions du Québec (DEC) connaît une diminution significative de ses dépenses réelles en services internes.  Cette baisse est le résultat des efforts de l’organisation pour respecter les orientations gouvernementales liées à la réduction du déficit."
54,"program","SC-AQL00","2011-12","2015-16","SOBJ, AUTH,EXP","Les dépenses varient d'une année à l'autre découlant de la nature cyclique du programme des recensements. Ceci est particulièrement prononcé dans les dépenses liées au personnel, transports et communications et services professionnels et spéciaux."
55,"program","SC-AQL00","2011-12","2015-16","SOBJ, EXP","Les dépenses varient d'une année à l'autre découlant de la nature cyclique du programme des recensements. Ceci est particulièrement prononcé dans les dépenses liées au personnel, transports et communications et services professionnels et spéciaux."
56,"program","SC-AQL00","2011-12","2019-20","SOBJ, AUTH,PLANNED_EXP","Les dépenses planifiées varient d'une année à l'autre découlant de la nature cyclique du programme des recensements. Les dépenses réelles suivent le même modèle."
57,"program","SC-AQL00","2017-18","2019-20","PLANNED_EXP","Les dépenses planifiées varient d'une année à l'autre découlant de la nature cyclique du programme des recensements. Les dépenses réelles suivent le même modèle."
58,"program","TC-BBO00","2011-12","2015-16","SOBJ","Malgré le solde négatif des dépenses de l’article courant Autres subventions et paiements du Programme de sécurité aérienne, un solde de dépenses positif est déclaré au niveau ministériel. Le Programme de sécurité aérienne recouvre les frais internes d’autres programmes durant l’exercice. Le solde négatif du Programme de sécurité aérienne s’explique par le fait que les revenus internes recouvrés sont supérieurs aux autres dépenses engagées dans le même article courant."
