"org_id","dept_code","abbr_en","legal_title_en","applied_title_en","old_applied_title_en","Status","enabling_instrument_en","description_en","PAS","FAA_schedule_institutional","FAA_schedule_HR_status","auditor_en","incorp_yr","federal_ownership_en","end_yr","notes_en","dp_status","ministry","institutional_form","eval_url_id","dept_website_id","article1_fr","article2_fr","other_lang_abbr","other_lang_applied_title","other_lang_legal_title"
148,"FBCL","FBCL","The Federal Bridge Corporation Limited","Federal Bridge Corporation",,"a","Canada Business Corporations Act, R.S.C. 1985, c. C-44","To provide users of the Canadian facilities of the international bridges located at Sault Ste. Marie, Point Edward, Thousand Islands, and Cornwall, Ontario, with safe and effective infrastructures.","FBP","III",,"Auditor General of Canada",2015,,,,99,2,"crown_corp",,117,"la","de la","SPFL","Société des ponts fédéraux","La Société des ponts fédéraux Limitée"
150,"FEDSO","FedDev Ontario","Federal Economic Development Agency for Southern Ontario","Federal Economic Development Agency for Southern Ontario",,"a","Order in Council P.C. 2009–1410 dated August 13, 2009, amending Schedule I.1 of the Financial Administration Act to include the Federal Economic Development Agency for Southern Ontario as a department. Order in Council P.C. 2009–1411 dated August 13, 2009, whereby the department of Industry transferred to the Federal Economic Development Agency for Southern Ontario the control and supervision of the portion of the federal administration in the department of Industry known as the Southern Ontario Regional Economic Branch.","The Federal Economic Development Agency for Southern Ontario (FedDev Ontario) works with communities, businesses, not-for-profit organizations and other levels of government in southern Ontario, to strengthen the region’s capacity for innovation, economic development and growth.","ESO","I.1","IV",,2009,,,,0,27,"dept_agency",,116,"l'","de l'","FedDev Ontario","Agence fédérale de développement économique pour le Sud de l'Ontario","Agence fédérale de développement économique pour le Sud de l’Ontario"
151,"FCAC","FCAC","Financial Consumer Agency of Canada","Financial Consumer Agency of Canada",,"a","Financial Consumer Agency of Canada Act, S.C. 2001, c. 9","FCAC has eleven objectives as set out by the FCAC Act: to supervise federally regulated financial institutions to ensure that they comply with federal consumer protection measures that apply to them, with undertakings relating to the protection of customers as defined in legislation, and with directions from the Minister of Finance to promote the adoption by financial institutions of policies and procedures designed to implement consumer protection measures, voluntary codes of conduct and financial institutions’ public commitments designed to protect the interests of customers to monitor federally regulated financial institutions to ensure that they comply with voluntary codes of conduct and respect the public commitments they have made to protect the interests of consumers and merchants to promote consumer awareness of the obligations of financial institutions to financial consumers and of all matters related to protecting consumers of financial products and services to foster consumer understanding of financial services and related issues in cooperation with government bodies, financial institutions, consumer groups and other organizations to collaborate and coordinate its activities with stakeholders to contribute to and support initiatives to strengthen the financial literacy of Canadians to monitor and evaluate trends and emerging issues that may have an impact on consumers of financial products and services to supervise payment card network operators to determine whether they are in compliance with the provisions of the Payment Card Networks Act and its regulations to promote adoption by payment card network operators of policies and procedures designed to implement provisions of the Payment Card Networks Act and its regulations to monitor implementation of voluntary codes of conduct adopted by payment card network operators and any public commitments they make regarding their commercial practices relating to payment card networks to promote public awareness about the obligations of payment card network operators under a voluntary code of conduct or the Payment Card Networks Act.","FNA","I.1","V","Deloitte",2001,,,,1,19,"dept_agency",,113,"l'","de l'","ACFC","Agence de la consommation en matière financière du Canada","Agence de la consommation en matière financière du Canada"
152,"FTRAC","FINTRAC","Financial Transactions and Reports Analysis Centre of Canada","Financial Transactions and Reports Analysis Centre of Canada",,"a","Proceeds of Crime (Money Laundering) and Terrorist Financing Act, S.C. 2000, c. 17","The Financial Transactions and Reports Analysis Centre of Canada  (FINTRAC) is Canada’s financial intelligence unit. The Centre exists to  assist in the detection, prevention and deterrence of money laundering  and the financing of terrorist activities, while ensuring the protection  of personal information under its control. FINTRAC’s financial  intelligence and compliance programs strive to disrupt the ability of  criminals and terrorist groups that seek to abuse Canada’s financial system and to reduce the profit incentive of crime.    FINTRAC is an independent agency that operates at arm’s length from the  law enforcement agencies and other entities to which it is authorized to  disclose financial intelligence. It reports to the Minister of Finance,  who is in turn accountable to Parliament for the activities of the  Centre. FINTRAC was established by, and operates within, the ambit of the  Proceeds of Crime (Money Laundering) and Terrorist Financing Act  (PCMLTFA) and its Regulations.","CFC","I.1","V",,2000,,,,0,19,"dept_agency",,118,"le","du","CANAFE","Centre d'analyse des opérations et déclarations financières du Canada","Centre d’analyse des opérations et déclarations financières du Canada"
153,,,"First Nations Financial Management Board",,,"d","First Nations Fiscal and Statistical Management Act, S.C. 2005, c. 9","   To assist First Nations in developing the capacity to meet their financial management requirements and improve financial performance by developing and supporting the application of general credit-rating criteria to First Nations and by providing the following financial services: review and audit services, assessment and certification services, financial monitoring services, and co-management and third-party management services respecting local revenues. To assist First Nations in their dealings with other governments respecting financial management, including matters of accountability and shared fiscal responsibility; to assist First Nations in the development, implementation, and improvement of financial relationships with financial institutions, business partners, and other governments to enable the economic and social development of First Nations; and to provide advice and policy research and review and evaluative services on the development of fiscal arrangements between First Nations’ governments and other governments. To establish standards respecting the form and content of First Nations financial administration laws and the approval of such laws that comply with the standards, the certification of First Nations financial management systems, and financial reporting.   ",,,,,2006,,2013,,99,,"shared_gov_corp",,,,,,,"Conseil de gestion financière des premières nations"
154,"FNSI","FNSI","First Nations Statistical Institute",,,"d","First Nations Fiscal and Statistical Management Act,   S.C. 2005, c. 9","To provide statistical information on, and analysis of, the fiscal, economic, and social conditions of Indians and other members of First Nations, members of other Aboriginal groups, and other persons who reside on reserve lands or lands of other Aboriginal groups; to promote the quality, coherence, and compatibility of First Nations statistics and their production in accordance with generally accepted standards and practices through collaboration with First Nations, federal departments, provincial departments, agencies, and other organizations; to work with, and provide advice to, federal departments and agencies and provincial departments and agencies on First Nations statistics; to work in cooperation with Statistics Canada to ensure that the national statistical system meets the needs of First Nations in Canada; and to build statistical capacity within First Nations governments.",,,,,2006,,2013,,99,,"crown_corp",,,"l'","de l'","FNSI",,"Institut de la statistique des Premières nations"
155,,,"First Nations Tax Commission",,,"d","First Nations Fiscal and Statistical Management Act, S.C. 2005, c. 9","   To ensure the integrity of the system of First Nations real property taxation and to promote a common approach to First Nations real property taxation nationwide, bearing in mind the variations in provincial real property taxation systems. To ensure that the real property taxation systems of First Nations reconcile the interests of taxpayers with the responsibilities of chiefs and councils to govern the affairs of First Nations, to prevent or provide for the timely resolution of disputes in relation to the application of local revenue laws, to assist First Nations in the exercise of their jurisdiction over real property taxation on reserve lands and to build capacity in First Nations to administer their taxation systems, and to develop training programs for First Nations real property tax administrators. To assist First Nations to achieve sustainable economic development through the generation of stable local revenues, to promote a transparent First Nations real property taxation regime that provides certainty to taxpayers, to promote understanding of the real property taxation systems of First Nations, and to provide advice to the Minister regarding future development of the framework within which local revenue laws are made.   ",,,,,2006,,2013,,99,,"shared_gov_corp",,,,,,,"Commission de la fiscalité des premières nations"
156,,,"Fredericton International Airport Authority Inc.",,,"a","Canada Not-for-profit Corporations Act (S.C. 2009, c. 23)","To manage, operate, and develop the airport.",,,,"Grant Thornton LLP",2001,"2/11 board members",,,99,2,"shared_gov_corp",,125,,,,,"Fredericton International Airport Authority Inc."
157,"FFMC","FFMC","Freshwater Fish Marketing Corporation","Freshwater Fish Marketing Corporation",,"a","Freshwater Fish Marketing Act, S.C. 1985, c. F-13","To purchase all fish lawfully fished and offered for sale, to create an orderly market, to promote international markets, to increase the fish trade, and to increase returns to fishers.","FFM","III",,"Auditor General of Canada",1969,,,,99,12,"crown_corp",,126,"l'","de l'","OCPED","Office de commercialisation du poisson d'eau douce","Office de commercialisation du poisson d’eau douce"
158,,,"Gander International Airport Authority Inc.",,,"a","Canada Not-for-profit Corporations Act (S.C. 2009, c. 23)","To manage, operate, and develop the airport.",,,,"Blair J. Jewer LLP",2001,"2/13 board members",,,99,2,"shared_gov_corp",,128,,,,,"Gander International Airport Authority Inc."
162,,,"Grain Appeal Tribunal",,,"d","Canada Grain Act, R.S.C.1985, c. G-10","The Tribunal's function is to examine appeals by those dissatisfied with the grade assigned by the Commission on an official sample.",,,,,1930,,2013,,99,,"dept_agency",,,,,,,"Tribunal d'appel pour les grains"
163,,,"Great Lakes Pilotage Authority","Great Lakes Pilotage Authority Canada",,"a","Pilotage Act, R.S.C. 1985, c. P-14","To establish, maintain, and administer a safe and efficient pilotage service in all Canadian waters in Ontario and Manitoba, as well as in Quebec south of the northern entrance to the St. Lambert Lock.","PAG","III",,"Auditor General of Canada",1972,,,,99,2,"crown_corp",,130,"l'","de l'",,"Administration de pilotage des Grands Lacs Canada","Administration de pilotage des Grands Lacs"
164,,,"Greater London International Airport Authority",,,"a","Canada Not-for-profit Corporations Act (S.C. 2009, c. 23)","To manage, operate, and develop the airport.",,,,"Ernst & Young LLP",1998,"2/11 board members",,,99,2,"shared_gov_corp",,121,,,,,"Greater London International Airport Authority"
165,,,"Greater Moncton International Airport Authority Inc.",,,"a","Canada Not-for-profit Corporations Act (S.C. 2009, c. 23)","To manage, operate, and develop the airport.",,,,"Grant Thornton LLP",1997,"2/14 board members",,,99,2,"shared_gov_corp",,103,,,,,"Greater Moncton International Airport Authority Inc."
166,,,"Greater Toronto Airports Authority",,,"a","Canada Not-for-profit Corporations Act (S.C. 2009, c. 23)","To manage, operate, and develop the airports.",,,,"PricewaterhouseCoopers LLP",1993,"2/15 board members",,,99,2,"shared_gov_corp",,234,,,,,"Autorité aéroportuaire du Grand Toronto"
167,,,"Halifax International Airport Authority",,,"a","Canada Not-for-profit Corporations Act (S.C. 2009, c. 23)","To manage, operate, and develop the airport.",,,,"Grant Thornton LLP",2000,"2/14 board members",,,99,2,"shared_gov_corp",,135,,,,,"Administration de l'aéroport international d'Halifax"
168,,,"Halifax Port Authority",,,"a","Canada Marine Act, S.C. 1998, c. 10","To manage the marine infrastructure and services in a commercial manner that encourages and takes into account input from users and from the community in which the port is located.",,,,"Grant Thornton LLP",1999,"5/7 board members",,,99,2,"shared_gov_corp",,200,,,,,"Administration portuaire d'Halifax"
169,,,"Hamilton Port Authority",,,"a","Canada Marine Act, S.C. 1998, c. 10","To manage the marine infrastructure and services in a commercial manner that encourages and takes into account input from users and the community in which the port is located.",,,,"PricewaterhouseCoopers LLP",2001,"5/7 board members",,,99,2,"shared_gov_corp",,134,,,,,"Administration portuaire de Hamilton"
170,"HMIRC","HMIRC","Hazardous Materials Information Review Commission",,,"d","Hazardous Materials Information Review Act, R.S.C. 1985, c. 24, (3rd Supp.)","To register claims for trade-secret exemptions and issue registry numbers; to adjudicate and issue decisions on the validity of claims for exemption using prescribed regulatory criteria; to make decisions on the compliance of material safety data sheets and labels within the Workplace Hazardous Materials Information System requirements as set out in the Hazardous Products Act, the Canada Labour Code, Controlled Products Regulations and provincial and territorial occupational health and safety legislation; and to convene independent, tripartite boards to hear appeals from claimants or affected parties on decisions, undertakings, and orders issued by the Commission.",,,,,1987,,2012,,99,,"dept_agency",,,"le","du","HMIRC",,"Conseil de contrôle des renseignements relatifs aux matières dangereuses"
171,,,"Health Council of Canada",,,"d","Canada Corporations Act, R.S.C. 1970, c. C-32","To monitor and publicly report on progress made in the implementation of the 2003 and 2004 First Ministers’ Accords on health care renewal, as well as on the health status and health outcomes of Canadians.",,,,,2004,,2013,,99,,"shared_gov_corp",,,,,,,"Conseil canadien de la santé"
174,"IRB","IRB","Immigration and Refugee Board","Immigration and Refugee Board of Canada",,"a","Immigration and Refugee Protection Act, S.C. 2001, c. 27","The Immigration and Refugee Board (IRB) is an independent, accountable  administrative tribunal established by Parliament on January 1, 1989 to  resolve immigration and refugee cases fairly, efficiently and in accordance with the law. The IRB ensures continued benefits to  Canadians: by only accepting refugee claimants needing protection in  accordance with international obligations and Canadian law; by  contributing to the integrity of the immigration system, the safety and  security of Canadians and upholding Canada’s reputation of justice and  fairness for individuals; and promoting family reunification. The IRB  also contributes to the quality of life of Canada’s communities by  strengthening our country’s social fabric and by reflecting and  reinforcing core values that are important to Canadians. These include  respect for human rights, peace, security and the rule of law.    The Minister of Immigration, Refugees and Citizenship is responsible for this organization.","IRB","I.1","IV",,1989,,,,0,24,"dept_agency",,154,"la","de la","CISR","Commission de l'immigration et du statut de réfugié du Canada","Commission de l’immigration et du statut de réfugié"
175,"IOG",,"Indian Oil and Gas Canada",,,"a","Treasury Board Decision No. 802602, July 23, 1986; and Treasury Board Decision No 820397, July 20, 1993; Indian Oil and Gas Act (R.S.C., 1985, c. I-7)","To fulfill the Crown's fiduciary and statutory obligations related to the management of oil and gas resources on First Nation lands. To further First Nation initiatives to manage and control their oil and gas resources (i.e., governance).","IOG",,"V",,1942,"3/9 board members",,,99,4,"spec_op_agency",,191,,,,,"Pétrole et gaz des Indiens du Canada"
177,"TRC","TRC","Indian Residential Schools Truth and Reconciliation Commission",,,"d","Order-in-Council P.C. 2008-0793","To develop a comprehensive report of the Indian Residential Schools (IRS) legacy, to educate the public through national events, to promote community reconciliation through events, to encourage individual participation through statement taking, to have a closing ceremony, and to establish an archive or research centre as a resource on the IRS legacy; To identify sources and create as complete a historical record as possible of the IRS system and legacy; To support commemoration initiatives of former IRS students and their families; To acknowledge IRS experiences, effects, and consequences; To provide a holistic, culturally appropriate, and safe setting for events; To promote and facilitate truth and reconciliation events at both the national and community levels; and To promote awareness and public education for Canadians about the IRS system and its effects.",,,,,2008,,2015,,99,,"dept_agency",,,"La","de la","CVR",,"Commission de vérité et de réconciliation relative aux pensionnats indiens"
179,,,"Industrial Technologies Office",,,"t","Department of Industry Act, S.C. 1995, c. 1 Treasury Board Decision No. 833402, February 28, 2007","The Industrial Technologies Office (ITO), a Special Operating Agency of Industry Canada, advances leading-edge research and development by Canadian industries. The agency manages two programs which continue to accept new applications including: the Technology Demonstration Program and the Strategic Aerospace and Defence Initiative. The agency also manages programs no longer accepting new applications: the Technology Partnerships Canada program, the Program for Strategic Industrial Projects, and the Hydrogen Early Adopters program.",,,,,2007,,2017,,99,7,"spec_op_agency",,,,,,,"Office des technologies industrielles"
180,,,"Institut national du sport du Québec",,,"a","Companies Act, R.S.Q. c. C-38","To help high-performance athletes training for the Olympic Games, world championships, and other international competitions to reach their highest level of performance.",,,,"Gosselin et associés LLP",1997,"0/11 board members",,,99,5,"shared_gov_corp",,150,,,,,"Institut national du sport du Québec"
181,,,"Inter-American Development Bank",,,"a","Articles of Agreement of the Inter-American Development Bank, 1959; implemented in Canada by the International Development (Financial Institutions) Assistance Act, R.S.C. 1985, c. I-18","The main mandate of the Inter-American Development Bank (IDB) is to foster the economic and social development of the IDB’s borrowing member countries, both individually and collectively. The IDB partners with countries to combat poverty and promote social equity through programs tailored to local conditions. Working with governments as well as with the private sector, the Bank seeks to achieve sustainable economic growth, increase competitiveness, modernize public institutions, and foster free trade and regional integration.",,,,"KPMG LLP",1959,"4.0% ownership",,,99,22,"inter_org",,138,,,,,"Banque interaméricaine de développement"
182,,,"Internal Trade Secretariat Corporation",,,"a","Canada Not-for-profit Corporations Act, S.C., 2009, c. 23","To provide administrative and operational support to the Committee on Internal Trade, a body established under Article 1600 of the Agreement on Internal Trade and continued under Article 1100 of the Canadian Free Trade Agreement (CFTA), and the Agreement’s working groups and other committees.",,,,"BDO Canada LLP",2005,"1/14 board members",,,99,7,"shared_gov_corp",,79,,,,,"Corporation du Secrétariat du commerce intérieur"
183,,,"International Bank for Reconstruction and Development",,,"a","Bretton Woods and Related Agreements Act, R.S.C. 1985, c. B-7","To assist in the reduction of poverty in middle-income and creditworthy poorer countries by promoting sustainable development through loans, guarantees, risk management products, and analytical and advisory services.",,,,"KPMG LLP",1944,"2.56 per cent ownership",,,99,19,"inter_org",,249,,,,,"Banque internationale pour la reconstruction et le développement"
184,,,"International Centre for Human Rights and Democratic Development",,,"d","International Centre for Human Rights and Democratic Development Act R.S.C. 1985, (4th Supp.) c. 54","To promote, advocate, and defend the democratic and human rights set out in the International Bill of Human Rights. In cooperation with civil society and governments in Canada and abroad, the International Centre for Human Rights and Democratic Development (Rights & Democracy) initiates and supports programs to strengthen laws and democratic institutions, principally in developing countries.",,,,,1988,,2012,,99,,"shared_gov_corp",,,,,,,"Centre international des droits de la personne et du développement démocratique"
185,,,"International Development Association",,,"a","Articles of Agreement of the International Development Association, 1960; implemented in Canada by the International Development Association Act, R.S.C. 1970, c. I-21","To reduce poverty by providing interest free loans and grants for programs that boost economic growth, reduce inequalities, and improve people’s living conditions.",,,,"KPMG LLP",1960,"4.55 per cent ownership",,,99,19,"inter_org",,249,,,,,"Association internationale de développement"
186,"IDRC","IDRC","International Development Research Centre",,,"a","International Development Research Centre Act, R.S.C. 1985, c. I-19","The International Development Research Centre (IDRC) helps developing countries find solutions to problems crucial to their citizens and communities. To fulfill our mandate, IDRC invests in knowledge, innovation, and solutions, accelerating development research on its way to big impact. We do this by enabling leaders in government, research, and business in the developing world—strengthening societies and building important relationships for Canada.","IDR",,,"Auditor General of Canada",1970,,,,99,22,"crown_corp",,141,"le","du","CRDI",,"Centre de recherches pour le développement international"
187,,,"International Finance Corporation",,,"a","Articles of Agreement of the International Finance Corporation, 1956; implemented in Canada by Appropriation Act No. 6","Help developing countries achieve sustainable growth by financing investment, mobilizing capital in international financial markets, and providing advisory services to businesses and governments.",,,,"KPMG LLP",1956,"3.17 per cent ownership",,,99,19,"inter_org",,142,,,,,"Société financière internationale"
188,,,"International Fisheries Commissions Pension Society",,,"a","Letters Patent pursuant to the Canada Corporations Act, 1957","To arrange for and administer the provision of pensions and insurance for employees of any international fisheries commission or organization whose seat or headquarters is established and maintained in Canada or the U.S.",,,,"James MacPhee, Fellow Chartered Accountant",1957,"8/14 board members are Canadian",,,99,12,"shared_gov_corp",,,,,,,"Société de caisse de retraite de la Commission internationale des pêcheries"
189,"IJC","IJC","International Joint Commission (Canadian Section)",,,"a","International Boundary Waters Treaty Act, R.S.C. 1985, c. I-17","To prevent and resolve disputes between the United States and Canada under the 1909 Boundary Waters Treaty and to pursue the common good of both countries as an independent and objective advisor to the two governments.","IJC",,"IV","Auditor General of Canada",1909,"3/6 board members",,,99,22,"inter_org",,143,"La","de la","IJC",,"Commission mixte internationale (section canadienne)"
190,,,"International Lake Memphremagog Levels Board",,,"a","The Board was created in 1920 pursuant to a Canada–US agreement","To provide a forum for dispute resolution regarding the regulation of the water levels of Lake Memphremagog in accordance with international obligations and federal and provincial legislation.",,,,,1920,"1/2 board members",,"This board is currently inactive with no current participation or support from ECCC.",99,23,"inter_org",,,,,,,"Commission internationale du lac Memphrémagog"
