"dept_code","type","name_en","name_fr","pa_last_year_5_auth","pa_last_year_5_exp","pa_last_year_4_auth","pa_last_year_4_exp","pa_last_year_3_auth","pa_last_year_3_exp","pa_last_year_2_auth","pa_last_year_2_exp","pa_last_year_1_auth","pa_last_year_1_exp"
"HRSD","c","Contributions to organizations to support the development of human resources, economic growth, job creation and retention in official language minority communities","Contributions à des organisations afin d'appuyer le développement des ressources humaines, la croissance économique, la création d'emplois et le maintien en poste dans les communautés minoritaires de langue officielle",11999780,11999780,12000000,12000000,12000000,11980750,12000000,11990000,12000000,12000000
"HRSD","c","Contributions to provincial/territorial governments, band councils, tribal councils, Aboriginal Skills and Employment Training Strategy agreement holders, municipal governments, not-for-profit organizations, professional associations, business and private sector organizations, consortia, industry groups, unions, regulatory bodies, ad-hoc associations, public health institutions, school boards, universities, colleges, CEGEPs, sector councils, and cross-sectoral councils to support enhanced productivity and competitiveness of Canadian workplaces by supporting investment in and recognition and utilizations of skills","Contributions aux gouvernements provinciaux et territoriaux, conseils de bande ou de tribu, détenteurs d'accord de la Stratégie pour la formation et les compétences des Autochtones, administrations municipales, organismes sans but lucratif, associations professionnelles, entreprises et organisations du secteur privé, consortiums, groupes de l'industrie, syndicats, organismes de réglementation, associations spéciales, établissements de santé publique, commissions scolaires, universités, collèges, cégeps, conseils sectoriels, conseils intersectoriels afin d'accroître la compétitivité et la productivité des milieux de travail en favorisant l'investissement dans les compétences de même que la reconnaissance et l'utilisation des compétences",29144123,13076885,29144123,13515423,27144123,16576408,28370183,11823737,46635690,30513655
"HRSD","c","Contributions to voluntary sectors, non-profit organizations, registered charitable organizations, provincial/territorial governments and institutions, [...]to support the development and delivery of outreach activities to inform, encourage, and direct Canadians to save for the post-secondary education of children through Registered Education Savings Plans and Canada Education Savings Program incentives","Contributions à l'intention des secteurs bénévoles, des organisations sans but lucratif, des organismes de bienfaisance enregistrés, [...] afin d'appuyer l'élaboration et la prestation d'activités de sensibilisation pour renseigner, encourager et enjoindre les Canadiens à épargner en prévision des études postsecondaires de leurs enfants au moyen de régimes enregistrés d'épargne canadien pour l'épargne-études",1085871,1085871,0,0,0,0,0,0,0,0
"HRSD","c","Contribution Labour Funding Program","Contribution Programme de financement du travail",0,0,0,0,500000,499769,500000,499999,500000,479510
"HRSD","c","Payments to non-profit organizations to develop national or provincial/territorial/regional educational and awareness activities to help reduce the incidence of elder abuse and fraud","Paiements aux organismes sans but lucratif pour mettre au point des activités d'éducation et de sensibilisation de portée nationale ou provinciale/territoriale/régionale afin de réduire l'incidence de la violence et de la fraude à l'égard des aînés",3814554,3814554,4903140,4903140,2438380,2438380,8250000,7559966,7921539,7921539
"HRSD","c","Payments to provinces, territories, municipalities, other public bodies, organizations, groups, communities, employers and individuals for the provision of training and/or work experience, the mobilization of community resources, and human resource planning and adjustment measures necessary for the efficient functioning of the Canadian labour market","Paiements aux provinces, territoires, municipalités, autres organismes publics, organisations, groupes, collectivités, employeurs et particuliers afin de pourvoir à la formation ou à l’expérience de travail, à la mobilisation des ressources communautaires et aux mesures de planification et d’adaptation de ressources humaines nécessaires au fonctionnement efficace du marché du travail canadien",636773583,568384907,628177802,518810029,588404161,497729310,782599566,703952348,800175138,786927415
"HRSD","c","Payments to provinces, territories, municipalities, other public bodies, organizations, groups, communities, employers and individuals for the provision of training and/or work or business experience, the mobilization of community resources and human resource planning and adjustment measures necessary for the social development of Canadians and other participants in Canadian life","Paiements aux provinces, territoires, municipalités, autres organismes publics, organisations, groupes, collectivités, employeurs et particuliers afin de pourvoir à la formation ou à l'expérience de travail ou des affaires, à la mobilisation des ressources communautaires et aux mesures de planification et d'adaptation des ressources humaines nécessaires au développement social des Canadiens et des autres participants à la vie canadienne",7735558,7478802,7964758,7797758,6438827,6271827,10587698,7944009,16637780,16470780
"HRSD","g","Allowance payments (R.S.C., 1985, c. O-9)","Versements d'allocations (L.R.C. (1985), ch. O-9)",528202660,528202660,531413924,531413924,512566866,512566866,530236046,530236046,544791268,544791268
"HRSD","g","Canada Disability Savings Bond payments to Registered Disability Savings Plan issuers on behalf of Registered Disability Savings Plan beneficiaries to encourage long-term financial security of eligible individuals with disabilities","Paiements de Bons canadiens pour l'épargne-invalidité aux émetteurs de régimes enregistrés d'épargne-invalidité au nom des bénéficiaires du régime enregistré d'épargne-invalidité afin d'encourager la sécurité financière à long terme des personnes handicapées admissibles",83427379,83427379,104996129,104996129,160169689,160169689,179917592,179917592,149550677,149550677
"HRSD","g","Canada Disability Savings Grant payments to Registered Disability Savings Plan issuers on behalf of Registered Disability Savings Plan beneficiaries to encourage long-term financial security of eligible individuals with disabilities","Paiements de Subventions canadiennes pour l'épargne- invalidité aux émetteurs de régimes enregistrés d'épargne- invalidité au nom des bénéficiaires du régime enregistré d'épargne-invalidité afin d'encourager la sécurité financière à long terme des personnes handicapées admissibles",190281476,190281476,230569779,230569779,273250623,273250623,320180391,320180391,338169730,338169730
"HRSD","g","Canada Education Savings grant payments to Registered Educations Savings Plan trustees on behalf of Registered Educations Savings Plan beneficiaries to encourage Canadians to save for post-secondary education for their children","Paiements de Subventions canadiennes pour l'épargne-études aux fiduciaires de régimes enregistrés d'épargne-études au nom des bénéficiaires des régimes d'épargne-études afin d'encourager les Canadiens à épargner pour les études postsecondaires de leurs enfants",760199839,760199839,781081862,781081862,820635620,820635620,858638013,858638013,899290584,899290584
"HRSD","g","Canada Learning Bond payments to Registered Education Savings Plan trustees on behalf of Registered Education Savings Plan beneficiaries to support access to post-secondary education for children from low-income families","Paiements de Bons d'études canadiens aux fiduciaires de régimes enregistrés d'épargne-études au nom des bénéficiaires des régimes enregistrés d'épargne-études afin d'appuyer l'accès à l'éducation postsecondaire des enfants de familles à faible revenu",105899211,105899211,104132462,104132462,118906530,118906530,133343188,133343188,164812403,164812403
"HRSD","g","Canada Student Grants to qualifying full and part-time students pursuant to the Canada Student Financial Assistance Act","Bourses canadiennes aux fins d'études destinées aux étudiants à temps plein et à temps partiel admissibles aux termes de la Loi fédérale sur l'aide financière aux étudiants",725360274,725360274,706839634,706839634,713927230,713927230,974571302,974571302,1322960043,1322960043
"HRSD","g","Energy Cost Benefit","Prestation liées au coût de l'énergie",-2833,-2833,-250,-250,-250,-250,0,0,-125,-125
"HRSD","g","Guaranteed Income Supplement Payments (R.S.C., 1985, c. O-9)","Versements du Supplément de revenu garanti (L.R.C. (1985), ch. O-9)",9372773071,9372773071,10066152466,10066152466,9921659952,9921659952,10922423837,10922423837,11658538968,11658538968
"HRSD","g","Old Age Security Payments (R.S.C., 1985, c. O-9)","Versements de la Sécurité de la vieillesse (L.R.C. (1985), ch. O-9)",31911357696,31911357696,33535507278,33535507278,35050472599,35050472599,36749167282,36749167282,38409875247,38409875247
"HRSD","g","Pathways to Education Canada upfront multi-year funding to support their community-based early intervention programs which will help disadvantaged youth access post-secondary education in Canada","Financement pluriannuel initial à Passeport pour ma réussite Canada afin d'appuyer ses programmes d'intervention précoce communautaires qui aideront les jeunes défavorisés à accéder aux études postsecondaires au Canada",6000000,6000000,0,0,0,0,0,0,0,0
"HRSD","g","Payments of compensation respecting government employees (R.S.C., 1985, c. G-5) and merchant seamen (R.S.C., 1985, c. M-6)","Paiements d'indemnités à des agents de l'État (L.R.C. (1985), ch. G-5) et à des marins marchands (L.R.C. (1985), ch. M-6)",2145,2145,1920,1920,1920,1920,1870,1870,1170,1170
"HRSD","c","Payments related to the direct financing arrangement under the Apprentice Loans Act","Paiements liés aux modalités de financement direct accordés en vertu de la Loi sur les prêts aux apprentis",0,0,0,0,27292,27292,665615,665615,1350805,1350805
"HRSD","g","Payments to the Canadian National Institute for the Blind for a national digital hub to improve library services for persons with a print disability","Paiements à l'Institut national canadien pour les aveugles afin d'améliorer les services de bibliothèque pour les personnes ayant une déficience de lecture des imprimés",3000000,3000000,0,0,0,0,0,0,0,0
"HRSD","g","Universal Child Care Benefit","Prestation universelle pour la garde d'enfants",2740095187,2740095187,2738493220,2738493220,8758825034,8758825034,1976071992,1976071992,12517048,12517048
"HRSD","g","Wage Earner Protection Program payments to eligible applicants owed wages and vacation pay, severance pay and termination pay from employees who are either bankrupt or in receivership as well as payments to trustees and receivers who will provide the necessary information to determine eligibility","Paiements en vertu du Programme de protection des salariés aux personnes admissibles pour les salaires, les indemnités de vacances, les indemnités de départ et les indemnités de cessation d'emploi qui sont dus par les employeurs en faillite ou mis sous séquestre, de même que les paiements aux syndics et aux séquestres qui fourniront les renseignements nécessaires pour déterminer l'admissibilité",32131039,32131039,22830715,22830715,23401319,23401319,18971126,18971126,16088897,16088897
"HRSD","g","Apprenticeship Grants","Subventions aux apprentis",102552420,96900000,114552200,99402626,114552200,100928500,114552200,100372000,99276252,88878000
"HRSD","g","Enabling Accessibility Fund Small Projects Grant","Subventions pour des projets de petite envergure du Fonds pour l'accessibilité",15262000,8703012,13650000,12453191,13650000,13531118,15650000,15630468,15650000,15649991
"HRSD","g","Federal Income Support for Parents of Murdered or Missing Children","Soutien du revenu pour les parents d’enfants assassinés ou disparus",10000000,70490,10000000,95830,10000000,52780,10000000,93800,10000000,102200
"HRSD","g","Grant for the Union Training and Innovation Program","Subvention pour la formation et l’innovation en milieu syndical",0,0,0,0,0,0,0,0,767836,767836
"HRSD","g","Grants to non-profit organizations for activities eligible for support through the Social Development Partnerships Program","Subventions aux organismes sans but lucratif pour les activités admissibles à l'aide financière du Programme de partenariats pour le développement social",12034219,6515103,12650242,5319561,14176173,7798333,9877302,9348151,7453169,6659845
"HRSD","g","Grants to not-for-profit, for-profit, and aboriginal organizations, municipal, provincial and territorial governments for adult learning, literacy and essential skills","Subventions à des organismes sans but lucratif, à but lucratif, et autochtones, et aux gouvernements municipaux, provinciaux et territoriaux pour l’apprentissage, l’alphabétisation et l’acquisition de compétences essentielles pour les adultes",6816829,175881,9348335,0,13133194,0,2938819,0,4180404,1675240
"HRSD","g","Grants to not-for-profit organizations, individuals, municipal governments, Band/tribal councils and other Aboriginal organizations, public health and educational institutions, Régies régionales, for-profit enterprises, research organizations and research institutes to carry out research on homelessness to help communities better understand and more effectively address homelessness issues","Subventions accordées à des organismes sans but lucratif, des particuliers, des administrations municipales, des conseils de bande ou de tribu et autres organisations autochtones, des établissements de santé publique et d'enseignement, des régies régionales, des entreprises à but lucratif, des organismes et instituts de recherche pour mener des recherches sur les sans-abri afin d'aider les collectivités à mieux comprendre et à répondre efficacement aux besoins des sans-abri",304677,304677,250000,0,500000,0,250000,250000,500000,500000
"HRSD","g","Grant Labour Funding Program","Subvention de financement du travail",1203000,1167982,1703000,1476451,1203000,1203000,1203000,1202836,1203000,1201164
"HRSD","g","Named grants for the Organization for Economic Co-operation and Development","Subventions désignées à l'Organisation de coopération et de développement économiques",100000,79944,100000,90021,100000,81005,100000,99700,400000,386974
"HRSD","g","New Horizons for Seniors Program","Programme Nouveaux Horizons pour les aînés",34325446,34011689,38236860,35263449,40701620,34836993,35040000,34681954,35218461,34991429
"HRSD","g","Pathways to Education Canada Grant","Subvention Passeport pour ma réussite Canada",0,0,6000000,6000000,9500000,9500000,9500000,9500000,9500000,9500000
"HRSD","g","Support for Post-secondary Education and Skills Training in the Province of Québec","Soutien de l'éducation postsecondaire et de la formation axée sur les compétences dans la province de Québec",0,0,0,0,0,0,0,0,25000000,25000000
"HRSD","o","Payments to provinces and territories for the purpose of Early Learning and Child Care","Paiements aux provinces et aux territoires aux fins de l’apprentissage et la garde des jeunes enfants",0,0,0,0,0,0,0,0,399669692,399669691
"HRSD","o","Payments to provinces and territories to deliver employment programs and services under the Canada Job Fund and under the Labour Market Agreements","Paiements aux provinces et aux territoires pour la prestation de programmes et de services d'emploi dans le cadre du Fonds canadien pour la création d'emplois et dans le cadre des Ententes sur le marché du travail",0,0,500000000,500000000,500000000,500000000,550000000,550000000,500000000,500000000
"HRSD","o","Payments to provinces and territories under labour market agreements to enhance the labour market participation among under-represented groups and low-skilled workers","Paiements aux provinces et aux territoires en vertu des ententes sur le marché du travail pour accroître la participation au marché du travail des membres des groupes sous-représentés et des travailleurs peu qualifiés",530778000,530713000,0,0,0,0,0,0,0,0
"HRSD","o","Payments to provinces and territories under the Multilateral Framework for Labour Market Agreements for Persons with Disabilities","Paiements aux provinces et aux territoires en vertu du Cadre multilatéral pour les ententes sur le marché du travail visant les personnes handicapées",222000000,218251611,222000000,222000000,222000000,222000000,222000000,222000000,222839454,222839454
"HRSD","o","Workforce Development Agreement","Ententes sur le développement de la main-d'œuvre",0,0,0,0,0,0,0,0,75000000,56293199
"INAC","c","Contributions in connection with the First Nations infrastructure","Contributions relatives à l'infrastructure des Premières Nations",0,0,26502251,26502251,26730568,26730568,28067096,28067096,8548450,8548450
"INAC","c","Contributions to Indspire","Contributions à Indspire",5000000,5000000,0,0,0,0,0,0,0,0
"INAC","c","Contribution for Inuit counselling in the South","Contribution au titre de services de consultation fournis aux Inuits dans le Sud",80000,80000,187000,187000,452000,452000,0,0,0,0
"INAC","c","Contribution for promoting the safe use, development, conservation and protection of the North's natural resources","Contribution pour promouvoir l'utilisation sécuritaire, le développement, la conservation et la protection des ressources naturelles du Nord",21467524,21166785,0,0,0,0,0,0,0,0
"INAC","c","Contribution for promoting the safe use, development, conservation and protection of the North's natural resources, and promoting scientific development for Indigenous Peoples and the North","Contributions pour promouvoir l'utilisation, le développement, la conservation et la protection sécuritaires des ressources naturelles du Nord, ainsi que le développement scientifique des peuples autochtones et du Nord",0,0,17754579,14643024,11378185,11378185,18400307,18400307,65706125,57481286
"INAC","c","Contribution to increase First Nations and Inuit Youth Participation in Education and Labour Market Opportunities","Contributions visant à accroître la participation des jeunes Inuits et des Premières Nations aux possibilités en éducation et sur le marché du travail",0,0,49688253,49660015,36390789,36390789,76217997,76217997,53147412,53147412
"INAC","c","Contribution to supply public services in Indian Government Support and to build strong governance, administrative and accountability systems","Contributions servant à la prestation de services publics dans le domaine du soutien aux gouvernements indiens et à l'établissement de systèmes solides de gouvernance, d'administration et de responsabilisation",0,0,223046550,219697456,222925961,222925961,247412053,247412053,190209313,190209313
"INAC","c","Contribution to support access to healthy foods in isolated northern communities","Contribution pour appuyer l'accès aux aliments sains dans les collectivités isolées du Nord",63880000,63879237,65499766,65499766,68498325,68498325,72981181,71871143,92140277,77487000
"INAC","c","Contributions for Groups of Indian Residential School survivors who wish to resolve their claim as a group under the Independent Assessment Process","Contributions aux groupes de survivants des pensionnats indiens qui souhaitent régler leur réclamation de façon collective dans le cadre du processus d'évaluation indépendant",650000,648475,646426,646426,654500,654500,775842,775842,997500,997500
"INAC","c","Contributions for eligible Aboriginal or other recipients for the purpose of providing advocacy and public education on a diverse range of issues related to the Indian Residential Schools Settlement Agreement","Contributions aux Autochtones ou autres bénéficiaires admissibles dans le but de faciliter la sensibilisation et l'information du public sur diverses questions liées à la Convention de règlement relative aux pensionnats indiens",2122484,2109144,0,0,0,0,0,0,0,0
"INAC","c","Contributions for emergency management assistance for activities on reserves","Contributions pour appuyer la gestion des urgences dans le cadre des activités dans les réserves",77219716,77129658,106053321,105299211,112982013,111982318,117918260,115686700,48468584,48468584
"INAC","c","Contributions for enhancing the financial management capability and networking facilities of the Government of Nunavut","Contributions visant à améliorer la capacité de gestion financière et les installations de réseaux du gouvernement du Nunavut",800000,800000,0,0,0,0,0,0,0,0
"INAC","c","Contributions for former students, their families, communities and groups of individuals for the purpose of facilitating regional or national Commemoration projects that address the Indian Residential Schools experience and provide the opportunity to share the initiative with family and community","Contributions aux anciens élèves, à leurs familles, à leurs collectivités et aux groupes dans le but de faciliter les projets de commémoration régionaux ou nationaux qui portent sur l'expérience dans les pensionnats indiens et qui permettent aux familles et aux collectivités de partager l'initiative",6167385,6167384,0,0,0,0,0,0,0,0
"INAC","c","Contributions for promoting the political, social and scientific development of Canada's three territories","Contributions pour la promotion du développement politique, social et scientifique dans les trois territoires du Canada",5367263,5361597,0,0,0,0,0,0,0,0
"INAC","c","Contributions for the purpose of consultation and policy development","Contributions au titre des consultations et de l'élaboration des politiques",23639729,23535348,17207802,15468247,17699751,16074751,25529251,24029251,62577980,61577980
"INAC","c","Contributions to First Nations Institutions for the purpose of enhancing good governance","Contribution versée aux institutions des Premières nations dans le but de favoriser une saine gestion publique",10376471,10376471,0,0,0,0,0,0,0,0
"INAC","c","Contributions to First Nations for the management of contaminated sites","Contributions versées aux Premières Nations pour la gestion de sites contaminés",32503248,32497133,29438103,29434295,22882344,22882344,50504655,50504655,79538944,72091707
"INAC","c","Contributions to First Nations, their organizations, provinces and third parties for Interim Measures and British Columbia Treaty Related Measures","Contributions aux Premières nations, à leurs organismes, aux provinces et aux tiers pour les mesures provisoires et les mesures couvertes par un traité de la Colombie-Britannique",5865921,5799421,0,0,0,0,0,0,0,0
"INAC","c","Contributions to Indian bands for Land Management Capacity Building","Contributions aux bandes indiennes pour le perfectionnement de capacités de gestion foncière",8621734,8621734,0,0,0,0,0,0,0,0
"INAC","c","Contributions to Indian bands for land and estates management","Contributions aux bandes indiennes pour la gestion de leurs terres et de leurs successions",9965392,9965391,0,0,0,0,0,0,0,0
"INAC","c","Contributions to Indian bands for registration administration","Contributions aux bandes indiennes pour l'administration de l'inscription",4213627,4213627,4348969,4341747,4522379,4522379,4994071,4994071,5077758,5077758
"INAC","c","Contributions to Indspire","Contributions à Indspire",817000,817000,0,0,0,0,0,0,0,0
"INAC","c","Contributions to beneficiaries and various implementing bodies for implementing comprehensive land claim agreements","Contributions aux bénéficiaires et à divers organismes de mise en œuvre pour la mise en œuvre d'ententes sur les revendications territoriales globales",215800473,215666360,0,0,0,0,0,0,0,0
"INAC","c","Contributions to implement the First Nations Land Management Act","Contributions pour la mise en œuvre de la Loi sur la gestion des terres des Premières nations",15580864,15508383,0,0,0,0,0,0,0,0
"INAC","c","Contributions to promote social and political development in the North and for Northerers","Contributions pour promouvoir le développement social et politique dans le Nord et pour les résidents du Nord",0,0,4282355,3888846,3477265,3477265,4737856,4737856,4803418,4803418
"INAC","c","Contributions to provide income support to on-reserve residents","Contributions visant à fournir un soutien au revenu aux personnes qui habitent dans les réserves indiennes",0,0,1002158672,991939516,1032502927,1032502927,1055905261,1055905261,715698725,715698725
"INAC","c","Grant to the National Centre for Truth and Reconciliation","Subvention pour le Centre national pour la vérité et la réconciliation",0,0,37357835,37357835,0,0,0,0,0,0
"INAC","g","Grant to the National Centre for Truth and Reconciliation","Subvention pour le Centre national pour la vérité et la réconciliation",0,0,0,0,0,0,0,0,10000000,10000000
"INAC","c","Contributions to provide women, children and families with Protection and Prevention Services","Contributions pour fournir des services de protection et de prévention aux femmes, aux enfants et aux familles",0,0,678553839,678553838,708789784,708789784,799489207,799489207,475946208,475946208
"INAC","c","Contributions to support First Nations Elementary and Secondary Educational Advancement","Contributions pour favoriser l'essor du régime d'éducation primaire et secondaire des Premières Nations",0,0,1370683664,1370659613,1399815020,1399815020,1680325427,1680325427,1119602300,1119602300
