"dept_code","type","name_en","name_fr","pa_last_year_5_auth","pa_last_year_5_exp","pa_last_year_4_auth","pa_last_year_4_exp","pa_last_year_3_auth","pa_last_year_3_exp","pa_last_year_2_auth","pa_last_year_2_exp","pa_last_year_1_auth","pa_last_year_1_exp"
"ACOA","c","Canada 150 Community Infrastructure Program","Programme de l'infrastructure communautaire de Canada 150",0,0,0,0,3481221,3481221,12535250,12535250,16600000,17168340
"ACOA","c","Contribution for the Innovative Communities Fund","Contributions pour le Fonds des collectivités innovatrices",34508394,34508394,41646990,41646990,40951128,40951128,47669438,47669438,38657762,41687697
"ACOA","c","Contributions for the Atlantic Innovation Fund","Contributions pour le Fonds d'innovation de l'Atlantique",47766112,47766112,45027132,45027132,37241006,37241006,30653122,30653122,44900000,36274360
"ACOA","c","Contributions for the Community Infrastucture Improvement Fund","Contributions pour le Fond d'amélioration d'infrastructure communautaire",12319305,12319305,0,0,0,0,0,0,0,0
"ACOA","c","Contributions to promote and coordinate economic development throughout Cape Breton Island","Contributions pour promouvoir et coordonner le développement économique dans l'île du Cap-Breton",0,0,4093435,4093435,2557053,2557053,992752,992752,126793,13381
"ACOA","c","Contributions under the Atlantic Policy Research Initiatives","Contributions en vertu des mesures de recherche stratégique visant la région de l'Atlantique",456848,456848,577558,577558,420170,420170,525445,525445,600000,768842
"ACOA","c","Contributions under the Business Development Program","Contributions en vertu du Programme de développement des entreprises",128584363,128584359,127625645,126625641,133140191,133140184,157272405,157272396,168290246,174809155
"ACOA","c","Contributions under the Community Futures program","Contributions en vertu du Programme de développement des collectivités",12614168,12614168,12664849,12664849,12604443,12604443,12627869,12627869,12642000,12641998
"ACOA","g","Grants to organizations to promote economic cooperation and development","Subventions à des organismes pour promouvoir la collaboration et le développement économique",484280,484275,442941,442941,350761,350761,202959,202959,2154401,607424
"AECB","c","Contributions to enable the research, development and management of activities that contribute to the objectives of the Research and Support Program, and the Canadian Safeguards Support Program","Contributions pour faciliter la recherche, le développement et la gestion des activités qui contribueront à la réalisation des objectifs du Programme de recherche et de soutien ainsi que du Programme canadien à l'appui des garanties",1365753,1365752,1733180,1733180,1391382,1391382,1565837,1565837,1931261,1931261
"AECB","c","Participant Funding Program","Programme d'aide financière aux participants",925000,282878,925000,60862,925000,170760,925000,233541,925000,598367
"AECB","g","Grants to enable the research, development and management of activities that contribute to the objectives of the Research and Support Program","Subventions pour faciliter la recherche, le développement et la gestion des activités qui contribueront à la réalisation des objectifs du Programme de recherche et de soutien",75000,75000,75000,75000,75000,74655,75000,68750,75000,74150
"AGR","c","Class contribution payments for the Transitional Industry Support program","Paiements de contribution par catégorie pour le programme d'aide transitoire à l'industrie",0,0,-1485,-1485,0,0,-24954,-24954,0,0
"AGR","c","Contribution payments for the AgriInsurance program","Paiements de contribution pour le programme Agri-protection",750830429,750830429,610882404,610882404,604148826,604148826,701496004,701496004,651704357,651704357
"AGR","c","Contribution payments for the AgriInvest Kickstart program","Paiements de contribution pour le programme de démarrage d'Agri-investissement",0,0,-5563,-5563,0,0,0,0,0,0
"AGR","c","Contribution payments for the AgriInvest program","Paiements de contribution pour le programme Agri-investissement",24875798,24875798,22675845,22675845,17915115,17915115,24986173,24986173,20036000,20036000
"AGR","c","Contribution payments for the AgriStability program","Paiements de contribution pour le programme Agri-stabilité",166509281,166509281,162677773,162677773,156496870,156496870,311527441,311527441,34791605,34791605
"AGR","c","Contribution payments for the Agricultural Disaster Relief program/AgriRecovery","Paiements de contribution pour le programme d'aide en cas de catastrophe agricole – Agri-relance",-4850106,-4850106,3361069,3361069,96568,96568,6923281,6923281,15135072,15135072
"AGR","c","Contribution payments for the Canadian Agricultural Income Stabilization program Inventory Transition Initiative","Paiements de contribution pour l'Initiative de transition du programme canadien de stabilisation du revenu agricole pour l'évaluation des stocks",-436178,-436178,-1010915,-1010915,-389586,-389586,-136027,-136027,-34752,-34752
"AGR","c","Contributions for agricultural risk management-Enhanced Spring Credit Advance program Business Risk Management","Contributions pour la gestion des risques agricoles - Gestion des risques de l'entreprise du programme d'avances printanières bonifié",-1227300,-1227300,-589623,-589623,-380878,-380878,-353075,-353075,-354634,-354634
"AGR","c","Contributions in support of Business Risk Management programs under the Agricultural Policy Framework - Province-Based programs","Contributions à l'appui des programmes de gestion des risques de l'entreprise en vertu du Cadre stratégique pour l'agriculture - programmes provinciaux",-1106213,-1106213,0,0,0,0,0,0,0,0
"AGR","c","Contributions in support of the Assistance to the Pork Industry Initiative","Contributions à l'appui de l'Initiative d'aide à l'industrie porcine",-3685687,-3685687,-8620021,-8620021,-53754367,-53754367,-20782068,-20782068,-17722056,-17722056
"AGR","c","Contributions to a transition to future risk management programming","Contributions à la transition aux programmes futurs de gestion des risques",0,0,0,0,0,0,-17844,-17844,0,0
"AGR","c","Loan guarantees under the Canadian Agricultural Loans Act","Prêts garantis en vertu de la Loi canadienne sur les prêts agricoles",-12829,-12829,35997,35997,98732,98732,611840,611840,385500,385500
"AGR","c","Payments in connection with the Agricultural Marketing Programs Act","Paiements relatifs à la Loi sur les programmes de commercialisation agricole",79080584,79080584,25996218,25996218,22157715,22157715,25670879,25670879,29030974,29030974
"AGR","c","Contribution payments for the AgriCompetitiveness program under Growing Forward 2","Paiements de contribution pour le programme Agri-compétitivité dans le cadre de Cultivons l'avenir 2",3127000,2504064,2827000,2668742,3127000,2858375,3275341,3270605,4503097,4475395
"AGR","c","Contribution payments for the AgriInnovation program under Growing Forward 2","Paiements de contribution pour le programme Agri-innovation dans le cadre de Cultivons l'avenir 2",59455000,38703245,69122591,63105754,66141619,62908011,63476500,61656052,59978554,57494019
"AGR","c","Contribution payments for the AgriMarketing program under Growing Forward 2","Paiements de contribution pour le programme Agri-marketing dans le cadre de Cultivons l'avenir 2",35500000,20464938,27300000,24308985,35568200,28867797,39351659,34250294,40443173,36531651
"AGR","c","Contribution payments for the Canadian Wheat Board Transition Costs program","Paiements de contribution pour le programme des coûts de transition de la Commission canadienne du blé",1600000,1436882,1600000,1455792,1700000,0,0,0,0,0
"AGR","c","Contribution payments for the control of diseases in the hog industry — Phase 2","Paiements de contribution pour la lutte contre les maladies dans l'industrie porcine — Phase 2",1000000,511244,2000000,652461,0,0,0,0,0,0
"AGR","c","Contributions for Cost-Shared Strategic Initiatives programming in Adaptability and Industry Capacity under Growing Forward 2","Contributions pour les programmes des initiatives stratégiques à coûts partagés dans le cadre de Cultivons l'avenir 2 pour l'adaptabilité et la capacité du secteur",28273341,23286085,31863064,30038615,31557519,28955199,27755585,27163776,28880456,28703415
"AGR","c","Contributions for Cost-Shared Strategic Initiatives programming in Competitiveness and Market Development under Growing Forward 2","Contributions pour les programmes des initiatives stratégiques à coûts partagés dans le cadre de Cultivons l'avenir 2 pour la compétitivité et le développement des marchés",86867329,64535129,107807836,88267210,93703322,78772226,103633511,91792901,90365721,85596738
"AGR","c","Contributions for Cost-Shared Strategic Initiatives programming in Innovation under Growing Forward 2","Contributions pour les programmes des initiatives stratégiques à coûts partagés dans le cadre de Cultivons l'avenir 2 pour l'innovation",90739330,76396764,105703531,91546837,115072728,110033641,101865754,100523555,95859536,88100021
"AGR","c","Contributions for the AgriRisk Initiatives program","Contributions pour le programme des initiatives Agri-risques",3150000,2246393,6400000,4018823,11400000,5270710,15200000,8284065,15950000,14423800
"AGR","c","Contributions in support of the Agricultural Greenhouse Gases program","Contributions à l'appui du programme de lutte contre les gaz à effet de serre en agriculture",5382000,4808261,5382000,4431565,5382000,3008614,2360500,1857891,5835245,5771446
"AGR","c","Contributions to support Investments in the Dairy Sector","Contributions à l’appui des investissements dans le secteur laitier",0,0,0,0,0,0,0,0,40861000,30817846
"AGR","c","Contributions to support the Canadian Agricultural Adaptation program","Contributions à l'appui du programme canadien d'adaptation agricole",23497419,15512708,10061000,1742371,10061000,2667292,6061000,2182027,3914201,2632964
"AGR","c","Contributions under the Career Focus program—Youth Employment Strategy","Contributions en vertu du programme Objectif carrière de la Stratégie emploi jeunesse",864000,657372,864000,684345,864000,800921,2564000,2335411,3214000,2948147
"AGR","c","Programming related to the Agricultural Flexibility Fund","Programme lié au Fonds Agri-flexibilité",39387692,38098681,0,0,0,0,0,0,0,0
"AGR","g","Canadian Cattlemen's Association Legacy Fund","Fonds pour l'avenir de la Canadian Cattlemen's Association",4453481,4453481,2706066,2706066,-205473,-205473,0,0,0,0
"AGR","g","Class grant payments for the Farm Income program","Paiements de subvention par catégorie pour le programme de revenu agricole",-2859,-2859,-119871,-119871,-95,-95,-20954,-20954,3851,3851
"AGR","g","Class grant payments for the Transitional Industry Support program","Paiements de subvention par catégorie pour le programme d'aide transitoire à l'industrie",-10187,-10187,-10610,-10610,-2021,-2021,-5278,-5278,0,0
"AGR","g","Grant payments for the AgriInvest Kickstart program","Paiements de subvention pour le programme de démarrage d'Agri-investissement",-48524,-48524,-66331,-66331,-36697,-36697,-83929,-83929,0,0
"AGR","g","Grant payments for the AgriInvest program","Paiements de subvention pour le programme Agri-investissement",208528580,208528580,149960139,149960139,143010095,143010095,152279055,152279055,147578690,147578690
"AGR","g","Grant payments for the AgriStability program","Paiements de subvention pour le programme Agri-stabilité",26249991,26249991,35141652,35141652,-1770468,-1770468,35373415,35373415,26827747,26827747
"AGR","g","Grant payments for the Agricultural Disaster Relief program/AgriRecovery","Paiements de subventions pour le programme d'aide en cas de catastrophe agricole - Agri-relance",13382,13382,0,0,0,0,0,0,0,0
"AGR","g","Grant payments for the Canadian Agricultural Income Stabilization program Inventory Transition Initiative","Paiements de subvention pour l'Initiative de transition du programme canadien de stabilisation du revenu agricole pour l'évaluation des stocks",-163039,-163039,-312775,-312775,-67376,-67376,-84398,-84398,-30269,-30269
"AGR","g","Grants in support of the Cost of Production Benefit","Subventions à l'appui de l'Indemnité pour coûts de production",-6634,-6634,-134510,-134510,-1929,-1929,-23540,-23540,2064,2064
"AGR","g","Grants in support of the Cull Breeding Swine program","Subventions à l'appui du programme de réforme des porcs reproducteurs",0,0,-1334323,-1334323,0,0,0,0,0,0
"AGR","g","Grants in support of the Grain and Oilseed Payment program","Subventions à l'appui du programme de paiements relatifs aux céréales et oléagineux",-34421,-34421,-50138,-50138,-14701,-14701,-35345,-35345,-5133,-5133
"AGR","g","Grants to agencies established under the Farm Products Agencies Act","Subventions aux offices établis conformément à la Loi sur les offices des produits agricoles",600000,0,600000,0,600000,0,600000,0,600000,0
"AGR","g","Agricultural research in universities and other scientific organizations in Canada","Recherches agricoles dans les universités et dans d'autres organisations scientifiques au Canada",299000,45000,0,0,0,0,0,0,0,0
"AGR","g","Grant payments for the AgriRisk Initiatives program","Paiements de subvention pour le programme des initiatives Agri-risques",100000,100000,100000,100000,100000,100000,100000,100000,100000,100000
"AGR","g","Grant payments for the Canadian Wheat Board Transition Costs program","Paiements de subvention pour le programme des coûts de transition de la Commission canadienne du blé",63200000,29779845,31500000,26802567,55596000,55263000,0,0,0,0
"AGR","g","Grant payments for the Churchill Port Utilisation program","Versement des subventions pour le programme d'utilisation du port de Churchill",4600000,4553244,4600000,4585371,4600000,2254199,4600000,0,0,0
"AGR","g","Grants to foreign recipients for participation in international organizations supporting agriculture","Subventions versées à des bénéficiaires étrangers pour la participation auprès d'organisations internationales qui appuient l'agriculture",883000,714160,883000,756170,883000,847849,3083000,3079475,4853001,4852942
"CCRA","o","Children's Special Allowance payments","Versements d'allocations spéciales pour enfants",235403434,235403434,214761199,214761199,309173282,309173282,319659267,319659267,333553349,333553349
"CCRA","o","Disbursements to provinces under the Softwood Lumber Products Export Charge Act","Versements aux provinces en vertu de la Loi sur les droits d'exportation de produits de bois d'œuvre",42344675,42344675,-15118882,-15118882,121481095,121481095,-109802,-109802,0,0
"CCRA","o","Payments under the Energy Costs Assistance Measures Act","Paiements en vertu de la Loi sur les mesures d'aide liées au coût de l'énergie",500,500,250,250,0,0,0,0,0,0
"CEAA","c","Contribution to the Province of Quebec—James Bay and Northern Quebec Agreement","Contribution à la province de Québec – Convention de la Baie James et du Nord québécois",246000,245500,245500,245500,246000,245500,246000,245500,245500,245500
"CEAA","c","Contributions to support the participation of the public and Indigenous groups in environmental assessment and policy dialogue, and to support the development of Indigenous knowledge and capacity related to environmental assessments and related activities – Participant Funding Component, Policy Dialogue and Indigenous Capacity Component","Contributions à l’appui de la participation du public et des groupes autochtones au processus d’évaluation environnementale et dialogue sur les politiques, et pour le soutien du développement des connaissances et capacités autochtones liées aux évaluations environnementales et aux activités connexes – composante de lʼaide financière aux participants, composante du dialogue sur les politiques et composante soutien des capacités autochtones",3606668,2518323,3669129,2069320,2473359,1438974,4332182,4332682,3726500,3581660
"CEO","o","Payment of subsidies to candidates' auditors for the 42nd general election.","Versement d'allocations aux vérificateurs des candidats concernant la 42ième élection générale.",0,0,0,0,1407924,1407924,38271,38271,2988,2988
"CEO","o","Quarterly allowances to registered eligible political parties and subsidies to electoral district associations for auditor's fee","Allocations trimestrielles aux partis politiques enregistrés admissibles et subvention aux associations de circonscription pour les frais de vérificateurs",15583211,15583211,8184963,8184963,0,0,0,0,0,0
"CEO","o","Reimbursement of election expenses of candidates for the 42nd general election, paid to assigned recipient.","Remboursement des dépenses électorales des candidats concernant la 42ième élection générale, versé au bénéficiaire désigné.",0,0,0,0,37901787,37901787,3576996,3576996,357151,357151
"CEO","o","Reimbursement of election expenses to candidates and payments of subsidies to candidates' auditors for the current year by-elections","Remboursement des dépenses électorales aux candidats et versement d'allocations aux vérificateurs des candidats concernant les élections partielles de l'année en cours",0,0,0,0,146361,146361,43233,43233,994074,994074
"CEO","o","Reimbursement of election expenses to candidates, and payments of subsidies to candidates' auditors for other general elections and by-elections.","Remboursement des dépenses électorales aux candidats et versement d'allocations aux vérificateurs des candidats d'autres élections générales et élections partielles.",0,0,0,0,62943,62943,199285,199285,24902,24902
"CEO","o","Reimbursement of election expenses to eligible candidates for the 2013 by-elections","Remboursement des dépenses électorales aux candidats admissibles pour les élections partielles de 2013",582326,582326,0,0,0,0,0,0,0,0
"CEO","o","Reimbursement of election expenses to eligible candidates for the March 2012 by-elections","Remboursement des dépenses électorales aux candidats admissibles pour les élections partielles de mars 2012",39858,39858,0,0,0,0,0,0,0,0
"CEO","o","Reimbursement of election expenses to political parties for the 42nd general election.","Remboursement des dépenses électorales des partis politiques concernant la 42ième élection générale.",0,0,0,0,64610235,64610235,-3955040,-3955040,0,0
"CEO","o","Reimbursement of eligible election expenses for other general elections and by-elections to candidates","Remboursement des dépenses électorales admissibles des autres élections générales et élections partielles aux candidats",0,0,33942,33942,0,0,0,0,0,0
"CEO","o","Reimbursement of eligible election expenses of other general elections and by-elections, to eligible political parties and candidates","Remboursement des dépenses d'élections éligibles des autres élections générales et élections partielles aux partis politiques et candidats éligibles",91131,91131,0,0,0,0,0,0,0,0
"CEO","o","Reimbursement of eligible election expenses to candidates for the 2014 by-elections","Remboursement des dépenses électorales admissibles aux candidats pour les élections partielles de 2014",0,0,505004,505004,0,0,0,0,0,0
"CEO","o","Reimbursement of eligible elections expenses to candidates for the 41st General Election","Remboursement des dépenses électorales admissibles aux candidats concernant la 41e élection générale",157363,157363,69295,69295,0,0,0,0,0,0
"CEO","o","Subsidies to electoral district associations' auditors","Allocations aux vérificateurs des associations de circonscription",0,0,0,0,865182,865182,1308468,1308468,852326,852326
"CFIA","c","Compensation payments in accordance with requirements established by Regulations under the Health of Animals Act and the Plant Protection Act, and authorized pursuant to the Canadian Food Inspection Agency Act","Paiements d'indemnisation conformes aux exigences prévues par les règlements pris en application de la Loi sur la santé des animaux et de la Loi sur la protection des végétaux et autorisés en vertu de la Loi sur l'Agence canadienne d'inspection des aliments",58292634,58292634,12555078,12555078,17131017,17131017,40867951,40867951,6372561,6372561
"CFIA","c","Contributions in support of the Federal Assistance Program","Contributions à l'appui du Programme d'aide fédéral",2125075,2125075,879210,879210,1802426,1802426,1243488,1243488,844000,804035
"CFIA","c","Contributions to the provinces in accordance with the rabies indemnification regulations of the Governor in Council of amounts not exceeding two-fifths of the amounts paid by the provinces to owners of animals dying as a result of rabies infection","Versement aux provinces conformément aux règlements édictés par le gouverneur en conseil sur l'indemnisation des victimes de la rage, de montants ne dépassant pas les deux cinquièmes des montants payés par les provinces aux propriétaires d'animaux morts de la rage",1200,1200,0,0,0,0,0,0,0,0
"CH","c","Contribution to Fathers of Confederation Buildings Trust, Charlottetown, PEI","Contribution à la fiducie des Édifices des Pères de la Confédération, Charlottetown",3000000,3000000,3000000,3000000,0,0,0,0,0,0
"CH","c","Contribution to the Harbourfront Centre","Contribution au Harbourfront Centre",0,0,0,0,0,0,1000000,1000000,5000000,5000000
"CH","c","Contributions for the Hosting Program","Contributions au Programme d'accueil",143166073,142844052,281941178,281941178,52554231,30549231,23219000,23219000,19753493,19753493
"CH","c","Contributions for the Sport Support Program","Contributions au Programme de soutien au sport",150655949,150448635,147743298,147701601,149745623,148895558,146856428,146856428,154346105,154016129
"CH","c","Contributions in support of the Building Communities through Arts and Heritage Program","Contributions pour financer le programme Développement des communautés par le biais des arts et du patrimoine",8413678,8387727,7736191,7281841,8414020,8287687,7436693,7436693,8008010,7930436
"CH","c","Contributions in support of the Canada History Fund","Contributions à l'appui du Fonds pour l'histoire du Canada",5116089,5115737,4580940,4493535,4202343,4202342,2700386,2668076,4381956,4381956
"CH","c","Contributions in support of the Celebration and Commemoration Program","Contributions à l'appui du Programme des célébrations et commémorations",10985960,10961419,20861399,17000545,34299135,27918034,95469230,82938775,108288808,106251876
"CH","c","Contributions in support of the Court Challenges Program","Contributions à l'appui du Programme de contestation judiciaire",330000,204678,180120,180120,425139,284576,444000,444000,549580,228628
"CH","c","Contributions in support of the Development of Official-Language Communities Program","Contributions à l'appui du programme Développement des communautés de langue officielle",210862597,210862596,217477283,217332230,217810293,217629716,225454917,221717092,219810906,218169576
"CH","c","Contributions in support of the Exchanges Canada Initiative","Contributions à l'appui de l'initiative Échanges Canada",17851696,17825216,17786939,17689072,17908103,17882378,18310937,18309465,18368661,18368651
"CH","c","Contributions in support of the Multiculturalism Program","Contributions à l'appui du Programme du multiculturalisme",0,0,0,0,2041874,1917127,5394522,5394321,5128365,5070801
"CH","c","Contributions to TV5","Contributions à TV5",5159974,5159974,3243671,3243670,2745200,2745200,2960900,2960898,2960900,2960900
"CH","c","Contributions to support the Aboriginal Peoples' Program","Contributions à l'appui du Programme des Autochtones",15871398,15680383,16156443,15982334,15600200,15561315,22233789,16632870,34083256,33229626
"CH","c","Contributions to support the Canada Media Fund","Contributions pour soutenir le Fonds des médias du Canada",134146077,134146077,134146077,134146077,134146077,134146077,134146077,134146077,134146077,134146077
"CH","c","Contributions in support the Enhancement of Official Languages Program","Contributions à l'appui du programme Mise en valeur des langues officielles",117582551,117582551,116354170,116353219,117887847,117791291,117322428,117322428,116469438,116469438
"CH","c","Contributions to support the Youth Take Charge Program","Contributions à l'appui du programme Les jeunes s'engagent",3660180,3636180,1860000,1860000,1659410,1659410,2155674,2155674,2050005,2050005
"CH","c","Contributions to the Canada Arts Presentation Fund","Contributions pour le Fonds du Canada pour la présentation des arts",19550642,19550438,19489303,19489289,23373182,23373182,17512462,17512462,18454937,18420890
"CH","c","Contributions to the Canada Arts Training Fund","Contributions pour le Fonds du Canada pour la formation dans le secteur des arts",22620000,22620000,22750000,22750000,22719000,22719000,22721000,22721000,22751640,22653000
"CH","c","Contributions to the Canada Book Fund","Contributions au Fonds du livre du Canada",34952073,34943918,34216682,34208972,34873423,34865958,35328323,35328323,36324935,36324934
"CH","c","Contributions to the Canada Cultural Investment Fund","Contributions pour le Fonds du Canada pour l'investissement en culture",2941902,2929002,2930978,2930978,1195605,1195605,2704505,2704505,3068012,3065512
"CH","c","Contributions to the Canada Cultural Spaces Fund","Contributions pour le Fonds du Canada pour les espaces culturels",25213791,23608376,23867477,23867477,21813455,21813455,100064737,100064737,99142713,99042512
"CH","c","Contributions to the Canada Music Fund","Contributions au Fonds de la musique du Canada",23547884,23547884,23557050,23557050,23684855,23684854,26240731,26240731,27290134,27289309
"CH","c","Contributions to the Canada Periodical Fund","Contributions pour le Fonds du Canada pour les périodiques",5417340,5277290,3193718,2998607,3364713,3208165,4190582,4190581,7275680,7216609
